"This is a nice diaper pail, especially since I can use my regular kitchen trash bags and am not required to purchase special refill bags which are quite expensive.",[]
"When looking for a diaper pail my husband and I wanted something easy to use, no expensive refill packs, and of course something that would hold in odor.",[]
We found all that in the Diaper Champ!,[]
We've been using ours for almost 8 mths now and love it.,[]
"Yes if you leave the pail open for long periods of time there might be an odor but this is easily fixable by placing an odor disc, like you put in vacum bags, in the current trashbag.",[]
You can get the discs most places you buy vaccum bags.,[]
This is a great prduct and I recommend it to all my mommy friends.,[]
"I purchased the ever popular diaper genie before I had my son, but was warned by several people that it was too small and difficult to use.",[]
"Then, I received the Diaper Champ at one of my showers.",[]
It's fantastic!,[]
It's twice the size of the genie and you can use ANY BAG--including the bags diapers come in.,[]
It's so simple to use and it has absolutely no smell.,[]
Our champ is placed between the baby's crib and the changing table!,[]
"When it's full, changing the bag is simple.",[]
I recommend this to all my expecting friends and am so glad I received it!,[]
Ok - newsflash.,[]
Diapers are just smelly.,[]
We've had this pail for 2.5 years now.,[]
It was our first and primary one.,[]
"There were no major smell problems until after one year, when our son started eating solids.",[]
"Also, we change the bag twice weekly as 3 days is about the max for smell-containment.",[]
Around 20-22 months we started shopping for a container that would be less smelly and didn't find one as good.,[]
(We have a cheaper one upstairs which broke immediately and always stunk!),[]
We finally just put the Diaper Champ in the attic a few months ago and use the cheap one with the flip-up lid - mainly since the cheapo fits inside the cabinet and we didn't notice a big difference in smell-control.,[]
(The most helpful action is to tie the dirty diapers inside a small plastic bag before putting them in the pail.,[]
)A couple of our friends have this pail and were pleased until the children started eating solid food and things got stinkier - but that's pretty much the consensus according to many reviews on the different pails.,[]
"I've knocked off a star since the mechanism isn't that intuitive (to grandmothers and babysitters, at least) and it frequently gets stuck when the bag starts getting full.",[]
"Plus there are some smell issues, as with any pail.",[]
"However, the fact that you can use regular trash bags is so much more convenient!",[]
I love this pail.,[]
In fact I purchased two.,[]
"I use one for all cloth items (diapers, soiled outfits...) and the other for disposable diapers and other trash.",[]
It uses your own garbage bags - I fill one with 2 gallons of water and borax and have never had a leak or a smell issue.,[]
My childs clothing - including cloth diapers - are virtually stain free.I highly recommend this item.,[]
I love this diaper pail.,[]
I think it works GREAT and it does conseal the odors.,[]
"Best yet, you can use any kind of tall kitchen bag, etc.",[]
"BUT... now our daughter is 14 months and we ""need"" to replace it.",[]
"I'm replacing it with the SAME, as it does work like a CHAMP.",[]
"Why... ya have to clean, scrub it down every now and then.",[]
"Inside the top is a FOAM seal, which eventually starts to deteriorate.",[]
I believe that is why we are now smelling diaper ordors.,[]
"But it worked wonderfully for over a year and I wouldn't want to test another pail, knowing this one will work for another year.",[]
A. Avins,[]
This is a good product to start and very easy to use.,[]
"But as baby gets older and begins solid foods, it is not effective as an odor controlling pail.",[]
It is simply a place to put dirty diapers.,[]
My daughter is now 10 months old and we had to remove the Diaper Champ from her nursery because it smells too bad.,[]
The ability to use the same bags I use in my kitchen and laundry room garbage cans is far and away a good enough reason to buy this unit over the genie.,[]
"Do they even sell their proprietary bags in the regular grocery store, or would I have to make a special trip to babiesRus to get refills?",[]
The answer to this question is not even worth thinking about - it's much easier to use the same bags.,[]
you couldn't ask for a better diaper pail.,[]
"one reason is, that you don't have to use certain bags inside the pail...can use a plain trash bag and second is that once you turn the handle over, you don't smell the dirty diapers.",[]
great product!,[]
This is a fantastic product.,[]
"It has a lot of room to store the dirty diapers, and yet there is little to no smell.",[]
"You know when it's full because the plunger won't go down all the way, and you can't return the handle to the other position.",[]
"When you take the garbage bag out, you can tell just how much smell you'd be in for with any other container.",[]
"I also like that you can use whatever garbage bags you want with this, instead of having to buy special ones.",[]
A good buy.,[]
"My husband and I selected the Diaper ""Champ"" mainly because you can use ordinary trash bags and not be roped into buying the specialty refill bags, and it was moderately priced (a little less than the Diaper Dekor).",[]
It also seemed that the reviews of this product were generally more positive...The positives are:1.,[]
You can use any trash bag2.,[]
Easy to use and refillThe negatives are:1.,[]
"The bag doesn't seal around the dirty diapers, so when it comes time to refill the bag, it's just like opening a regular trash can.",[]
Smells like the Champ is trying to knock YOU out with odor!2.,[]
"The plastic seems to smell, ie.",[]
"You put a dirty diaper in the hole, and flip the handle to dump the diaper into the champ.",[]
"That ""side"" of the plastic dumper-thingie is in contact with the air inside the dirty diaper changer, so when you flip it over the next time to dispose of another diaper, you smell the last 8 diapers you put in there...pretty gross.3.",[]
"The ""odor seal"" (some soft material) really seems to retain odor.",[]
"It cannot be washed or replaced, so after a while, the Diaper ""Champ"" smells even when freshly washed and deodorized (I'm talking about hosing down outside and scrubbing with Clorox cleanser!).",[]
Super-frustrating!,[]
"This is my primary complaint.Okay, so some things are a given as far as disposal systems go (ie.",[]
"*some* odor, must empty frequently, must wash and disinfect occasionally), but still I think this product leaves much to be desired.We're going to try another disposal system.",[]
This product is much easier to use than others.,[]
"I agree with other reviewers that this is a literally stinky product, the seal has a foam that absorbs odors.",[]
"Considering the high maintenace cost of other diaper disposal products, I figured out how to make this one stink-less.",[]
I also have a hard time believing that any diaper disposal is completely odor free without effort.,[]
"If you follow these simple steps, you will be happy:1.",[]
Put dirty diaper and wipes in a sandwich bag before disposal.2.,[]
Use scented garbage bags.3.,[]
"Once a day, wipe the plunger, sides and seal with Lysol or Clorox wipes, both sides.",[]
Get the wipe in there really good to be sure you are reaching the foam.,[]
(You'll know what I mean if you see it.)4.,[]
"When the gaskets get old, you can call the company and they will replace them.",[]
Stink free.,[]
"I was set on the diaper genie until some friends of ours, who have a baby who is 7 wks older than our little girl, told us about the diaper champ.",[]
"There are two things that are very appealing about this - 1.  you can use your own kitchen trash bags, or any other large bag (you don't have to buy special ones!)",[]
and 2.,[]
"It rarely smells at all.We have used this for the last 5 months, and empty it only once a week.",[]
"By the last day of the week, you might start to notice an odor, but that's only if there are several messy diapers in it.",[]
"Every time I change the bag, I spray Lysol down in it, just to kill any possible germs.",[]
I highly recommend this for every mom-to-be or new parent!,[]
It's easy to use and I am so glad our friends told us about it.,[]
"I originally had another pail and it broke after about 9 months of use, so I got this one.",[]
I love it!,[]
It is very easy to use and keeps the diapers away from little hands.,[]
It has a large capacity and cuts back on frequent trips to the trash can.,[]
I keep a stick on air freshner in the bottom and it helps with lingering smells.,[]
Also no expensive refills to buy!,[]
Great pail.,[]
"The first time I used this diaper pail was at [a store] in the ""family"" room and I absolutly loved it, so my husband and I went out and bought one (since the other one broke, understandibly from too much abuse).",[]
It keeps odor in and it is so easy to use.,[]
You just drop the diaper in and flip the handle.,[]
"There are no little breakable parts, so this pail can take lots of abuse (ours has).",[]
I have told all my freinds and family to stop using their other pails and buy this one.,[]
I would pay three times what they are asking to have this product!,[]
I own this original diaper champ and I couldn't have been more pleased with it.,[]
I got it when I had my first child and I will be using it again shortly with my second.,[]
We used the diaper champ until my daughter was potty trained (at 2.5 years) and never had a problem with it.,[]
Here are the highlights:1.,[]
No special bags to purchase.,[]
We used the GLAD ODOR SHIELD kitchen trash bags and the only time there was even a slight odor was when we changed the bags out.,[]
"I think my husband sprayed it with lysol and ""aired"" it out maybe every 6 months.2.",[]
No odor!,[]
See #1 comment.,[]
"Also, my sister-in-law had the diaper genie and every time you went near her son's room you wanted to clip a clothes pin on your nose!",[]
We kept our diaper champ in the bathroom next to the changing table (which usually smaller rooms hold smells longer and stronger) and no one could ever tell we stored dirty diapers in there.3.,[]
My husband loved it!,[]
"I think he mainly liked the ""thunk"" of the plunger every time he put a diaper in, but hey-anything that makes changing a diaper more fun for a guy is a good thing!",[]
:-)4.,[]
Easy to change.,[]
When we first got the diaper champ the latch to open and close it to change out the bag was a bit stiff and took some work to open.,[]
But within a few weeks it was easy to open but still firm enough to hold it closed securely.My final word:  I'm getting everythig ready for my next baby and just pulled the diaper champ out of storage (haven't used it for 2 years).,[]
I opened it expecting some kind of offensive odor and was pleasantly surprised when I couldn't really smell anything.,[]
"There was a trace of that ""plastic disposable diapers once lived here"" but you needed to literally put your nose right in it to smell that.",[]
"Overall, this is an excellent product and a great price too!",[]
Excellent diaper disposal unit.,[]
I used it in conjunction with Glad 3ply kitchen trash bags with odor control (scented).,[]
I am soooo pleased with this product!!!,[]
A wise investment for the pocketbook & for the nose!!,[]
!,[]
We love our diaper champ.,[]
It is very easy to use just drop the diaper in and flip the top over.,[]
No need to stick your hand inside.,[]
"No hint of an odor, even when you are putting another dipaer in.",[]
"When it gets full, just put in a new trash bags.",[]
The best feature of all is that even the most curious little ones can't get into the diapers.,[]
"Before we found the diaper champ, we had another diaper pail and our son learned to open it and pull the diapers out.",[]
That is no longer a problem!,[]
!,[]
"We first had the Diaper Genie, but the proprietary bags make it lame and cost prohibitive.",[]
"With the champ you can line the bottom of the entire thing with costco's kirkland kitchen bags, then with each changing throw the stuff in a small produce or plastic grocery bag, then throw it in the champ and your good to go.",[]
It just works and zero I mean zero smell!,[]
"This is a good concept, easy to use, no special bags etc.",[]
"BUT, when the diapers get bigger they get stuck very easily and very few fit even though this thing is much bigger than the diaper genie.",[]
"ALso, watch out for the smell.",[]
I feel like the plastic has permanenely absorbed the poop odor and no amount of cleaning or bleaching can get it out.,[]
I'm expecting another baby and don't plan on using it.,[]
Turned out to be a total stink bomb.,[]
Read my new review.,[]
It absolutely reeks after 16 months.,[]
Amazon will not let me alter the star rating or it would be only one starDo NOT BUY THIS PIECE OF JUNK.,[]
It WILL STINK TERRIBLY in a little over a year because they put a foam and cloth gasket (porous) to keep the stink in.,[]
Not a good design.,[]
"[for laughs, I will leave the old review here]We originally got the diaper champ because it was a locking container that could accomodate cloth diapers.",[]
"We didn't end up cloth diapering after all, but feel fortunate to have gotten the champ.Reasons we love the champ:*1) Cost- no specialized (expensive) bags.",[]
This takes any mid-sized household trash bag.,[]
*2) Effectively controls odors.,[]
"We've put some really eye-watering, throat gagging diapers into this contraption and the smell doesn't sneak out- even over time.",[]
"However, sometimes you have to brace yourself before opening the cover and tying off the bag.",[]
That smell can bowl you over.,[]
*3) Easy enough for visitors to use- too difficult for them to play with.,[]
"Many of the ""grown-ups"" in my world can't help but tinker with whatever new items are placed before them.",[]
I'm thrilled they can't figure out how to open the DC.,[]
"As it emits a powerful odor when the lid is opened, I'm happy they can't figure it out.",[]
"I think this lid will confound any toddler, but it's really simple for parents once you get the concept down.I just wish it could empty its own ""payload.""",[]
I'll definitely be first in line for the Diaper Champ robot.,[]
Two girlfriends and two family members put me onto this diaper pail.,[]
"They each had tried the Diaper Genie and had horrible results with eventual smells, and costliness of buying proprietary DG cartridges.",[]
"My family members eventually started bringing every dirty diaper out to the trash and leaving just wet diapers in the DG, that is until they found out about the Diaper Champ!Wow, what a difference, it seals in orders very well and using normal 8 - 13 gallon trash bags makes it economical.",[]
"The ease of use factor is amazing, drop a dirty diaper in the hole, grab the handle, give it a flip, the plunger pushes the diaper down and it drops into the can with a little gravitic help.No wrenching, turning, fighting a cartridge bag system.Opening it for the first time was a little hard, but look at that from a child's point of view, a toddler is not going to get into it, and neither is a dog.","[('drop', 0.07241357850357448)]"
"Also, it needs to be away from the wall a little bit, so that it's flip top access lid locks into place and doesn't plop back down, but when engaged, the top will stay open so you can get at the bag of diapers within without having it fall onto your hand.We keep a little can of Oust nearby, spritz it before opening the top, grab the bag at it's neck to close off stinky odors, lift it out, twist it at the top and secure it with a twist-tie, and away we go to the garbage can.","[('secure', 0.0724135785035745)]"
"And we take antibacterial wipes and run them around in the plunger area on both sides, voila, it's clean.At 3 months, we change the bag about 1 - 2 times a week.",[]
"Maybe as baby grows into larger diapers it will be more like 2 - 3 times a week.Still, that's better than taking every dirty diaper (8 or more a day) outside to the garbage can, especially in a Minnesota winter.",[]
The diaper champ begs to be knocked out.,[]
It is wishful to think that this contraption controls the stink.,[]
"If anything, it allows the diapers to ferment into a far worse state than if a person on a daily basis simply tied off the bag and took the soiled diapers out of the house.",[]
"Diapers don't really smell bad unless they are given time to ripen, for which the champ is perfect.",[]
The diapers actually smell far worse and stronger in the champ after a day than in a open paper grocery bag coupled with a plastic bag.,[]
"(i know my kid's waste stinks so believe me i know the paper bag works better and is easier for throwing out other baby-changing materials, dare to compare)The chute and sliding weight, while creative, is not that effective.",[]
The weight like some others have mentioned needs help towards the end of a bag and sometimes when the bag is not that full.,[]
My real problem lies with the chute.,[]
"If any baby waste gets smeared around the chute, or in the sliding mechanism, that mess will need to be cleaned and that's a waste of time.",[]
"Also, that means putting dirty wipes down the chute is a no-no b/c they will just soil the mechanism.",[]
"One person made a good suggestion of lining the chute hole with a plastic bag but i would prefer not to have bag the garbage b/f i put it in another garbage bag not to mention having to pull out a new bag for every diaper.Lastly, changing the bag is a pain.",[]
I'm a dexterous person but i've spent a number of times clawing this thing open.,[]
"Fitting the bag and wrapping it around the interior gate is another inconvenience.A person really interested in controlling the stink is better off using any old garbage can lined with a bag, and on a daily basis changing it, and tying it off.",[]
In my opinion the smell is minimal that way and nonexistent compared to a full diaper champ.Where or when is this thing the champ?,[]
At the baby shower this item lives up to its name.,[]
"Everybody ooohs and aaaahs, the presenter will be slapped on the back and carried around the room on everybody's shoulders.",[]
"It ""looks"" like it should be a holy grail; better than the Stanley Cup.",[]
I gave this to dear friends and i was really proud of myself (even though my wife picked it out).,[]
"Oh what the heck, for the feeling it gives you at the shower you should buy two.",[]
The other should go on your mantel to remind you of your supremely thoughtful purchase.,[]
"Good luck, i'm going to go rub mine for luck.",[]
I waited to review this until I saw how it performed in the really-stinky-diaper stage.,[]
"Now, with my daughter at 1 year and eating lots of solids (and making really stinky diapers), I can happily recommend the diaper champ.",[]
"A couple suggestions: 1) as baby's poop gets stinkier, empty more often (at least once a week) and 2) every time you empty, spray with Lysol or similar product and wipe out with antibacterial cleaner.",[]
"This second step has kept the plastic from retaining a bad smell.I gave 4 stars because it's not ""perfect"" -- sometimes a little smell leaks out if it's very full.",[]
"But all around a good product, and not needing special refill bags is a huge benefit for a busy mom.",[]
The Diaper Champ has done everything it is said to - contains dirty diapers with little or no smelly mess.,[]
"Our 19 month old son can now ""help"" mommy/daddy put away the ""poo-ie"" diapers.",[]
We were given a box of 500 trash bags - purchased from Sam's or Costco type places - and we haven't even come close to finishing the box.,[]
We've used the Champ since day one and love it.,[]
"No strangely twisted, sausage-link diapers to pull out and trash.",[]
"Easy to clean, little or no smell - I mean it holds diapers so when you open it to empty it you have to be prepared - but no odor during normal use.",[]
Definitely Diaper Champ!,[]
!,[]
Smell?,[]
No problem.,[]
Make sure the bag is inserted correctly (not sticking out of the Champ).Getting clogged?,[]
"Time to change the bag - no problem.Spray with Lysol once in a while to reduce germs/bacteria.If you're really grossed out by the smell when you change it, drop one or two dryer sheets inside before inserting the new bag.",[]
Or use about a half-cup of odor-killing kitty litter.My only issue is that the lid falls closed when I'm prepping a fresh garbage bag.,[]
I can live with that.,[]
"As a nanny, I used many different diaper pails.",[]
Now I have my own child I decided to give this one a try.,[]
"I like the design, the fact that I can use regular trash bags and also that I can use it for cloth diapers which we switched to after a couple of weeks.",[]
This is by far my favorite diaper pail.,[]
It is cost effective due to using regular bags and it does the job well.,[]
I have had a diaper genie for almost 4 years since my first son was born and I have been using it with my second as well.,[]
I thought I'd try the champ to save $ on the genie refills.,[]
Well it is not a $ saver because it does not hold the odor inside so I was constantly changing the trash bags.,[]
"The diaper genie is not odorless, but it does a much better job of keeping the room fresh smelling for a longer period before you have to empty it.",[]
The champ is just like a regular trash can with a lid-just looks fancier.,[]
I suppose you could use it as a regular trash can in your child's room-they wouldn't be able to get into it!,[]
"Don't waste your $ to ""save"" $!",[]
Buy the genie-your nose will thank you!!,[]
"Also, if you don't keep the dirty wipes enclosed in the diaper, they get this thing all dirty and you have to clean it!",[]
YUCK!,[]
"Before my first child was born, I was all set to buy the Diaper Genie but then a friend told me about the Diaper Champ.",[]
She said that it did a good job and I didn't have to buy any special bags.,[]
So I went out and bought it along with a big box of tall kitchen bags.,[]
"My son is now 4 months old, and so far it is working great.",[]
It is in the nursery and there is no smell at all.,[]
"I am usually very sensitive about any bad smells, and so is my mom but even she couldnt smell any odors.",[]
So far this has been a great product.,[]
"The lid is definately tight, but it does not bother me much.",[]
"Hopefully, it will still work when the diapers get REALLY smelly!",[]
But so far so good!,[]
!,[]
We got this diaper pail as a shower gift before my son was born.,[]
"He's now 13 months old so we have really given it a run for it's money.Pros:- I love that you can use regular kitchen sized trash bags.- It's easy to use - just drop the diaper in and flip the handle.- It can hold a lot of diapers(although the more diapers you pack in there, the worse the smell).Cons:- The smell!!","[('run', 0.08916266806165124)]"
It didn't smell at all the first six months but once we started my son on baby food the smell was horrific!,[]
I understand that you have to change the bag often but this thing doesn't even contain the smell after one day of dirty diapers!But I guess I still like it more than the Diaper Genie.Bottom line - all diaper pails smell - so do you want one that's easy to use and can use regular bags or do you want one that require expensive refills and isn't as user friendly?,[]
"We bought 2 diaper pails, a Diaper Champ for downstairs and a traditional kind for upstairs.",[]
After just a couple weeks we bought a second Diaper Champ.,[]
Anyone who has ever had to change a diaper at our house is impressed with how easy it is to use.,[]
Just put the diaper in the hole and flip the handle over.,[]
We like that we don't have to buy special replacement bags.,[]
We just use a stick-on deoderizer and the cheap scented trash can liners on a roll (which last a very long while).,[]
"Our son is almost 10 months old and we have rarely noticed any escaped odors, except occassionally when the pail is full.",[]
Our only complaint would be that the diapers do tend to build up in the center making the handle hard to flip over.,[]
"But, a quick shake of the pail can solve that problem.",[]
Would definitely reccomend this pail over any other!,[]
I almost bought the Diaper Genie on name alone (my name is Jeannie!,[]
)and the fact that EVERYONE says you must get one (Well if everyonetold you to jump off a bridge...).,[]
Have you looked at the price of therefills????,[]
Think about the number of diapers you will use and the factthat every diaper needs its own cover.,[]
"It's a great idea, but the wholepoint is to eliminate odor, and the Diaper Champ does that while usingregular tall kitchen bags.",[]
"Also, the Diaper Champ only needs onehand to use.",[]
"There is a smell when changing the bag, but it isn't anydifferent than changing a kitchen trash can.",[]
I highly recommend thisproduct.,[]
This is the best diaper pail ever made!,[]
The best things about this product are:1.,[]
No stinky diaper smell!,[]
"Guests don't smell it when they are in the bathroom with it, and I don't smell it when I put a diaper in!2.",[]
No expensive refills!,[]
You can use regular trash bags or aBummis Waterproof Bag (X-Large 40-54 Qt.,[]
"Diaper Pail-25""X29"")!3.",[]
I can drop a diaper in it with one hand if I wanted to!,[]
"Very useful if you have a baby in your arms.If I have anything to do with it, I will NEVER use any other diaper pail again!",[]
I love the Diaper Champ!,[]
"It holds a ton of diapers, it doesn't stink, it's easy to use, and you can use regular garbage bags instead of having to buy expensive refills!",[]
I can't believe how good the odor control is.,[]
I buy the cheap scented garbage bags from the Dollar Store and they keep any odor from escaping!,[]
I will never use anything else!,[]
