"They look the exact same, cost the same, and seem to have the same functions?",[]
Thanks!!!!!,[]
!,[]
This mini-prep-processor is the second Cuisinart product I have bought from Amazon.,[]
The first was a refurbished convection toaster oven.,[]
"The careful engineering and attractive, simple design of both products impress me.",[]
"Also impressive is how wonderfully well they work!After reading a lot of the Amazon reviews-- not all 350+-- I was convinced this mini-chopper-processor would be a better replacement for the small, inexpensive Black and Decker that burned out with no warning after one year of very mild use.",[]
Avoid Black & Decker in the kitchen is my conclusion.,[]
"Anyway...this Little Honey, that's what I call him, arrived the day before Thanksgiving.",[]
Before that I'd only used the B/D to pulverize cat food twice a day.,[]
The cats spit out meat or fish pieces they'd have to chew.,[]
"Waste of money, so they get instant grind instead.What good timing!",[]
I put that Little Honey right to work.,[]
"The slightly larger cup capacity, two speeds, a strong sounding motor of the Cuisinart, and its crisp good looks kept inviting me to whip up quick dips, sauces and icings for unexpected company-- as well as, the morning and evening cat food.The compact size lets me keep it up on the counter.","[('speeds', 0.096633526209691)]"
I get more use out of it than my large food processor down in the cupboards somewhere.,[]
"If it were a little larger I would replace the big processor.Why only 4 stars?I think it is a great little tool, but I am waiting to see how long before the motor burns out.",[]
"And 4 stars because it does not chop evenly, when I chop such chunky things as celery or certain mixtures of wet cat food large pieces are left.",[]
"(No, not together!",[]
I wash it out well between food types.,[]
)Usually I run it until I smell the motor burning then stop.,[]
"That is after the recommended 10 to 12 seconds, alternating between Lo and Hi speeds.",[]
"Some other reviewer mentioned the burning smell also, so I assume it is normal...Anyway, if it is still doing this before the warranty runs I will have to send the Little Honey back.",[]
"For now, I love it very much.",[]
This never worked for us.,[]
It was a hassle to return it for a (...)item.,[]
"Easy to use and easy to clean (just be careful when cleaning the blades because their handling can be a bit tricky and you might get yourself a couple of deep cuts) but, overall, the product offers good value for people that cook often and don't want to spend too much time chopping things.",[]
I have been very happy with this product.,[]
It works well and not a bad price.,[]
My only gripe is the plastic container.,[]
"The quality is not great, but I guess you can't expect too much better for the price.",[]
"It's very useful and a big help in the kitchen since my gf want me to be responsible for all the chopping, preparing meals :)",[]
I needed a way to liquify single servings of food to provide nutrition through my mother's feeding tube.,[]
"She does not tolerate the commercial nutrition, but does well with her customary food.",[]
"I tried using a blender, but the end result was inconsistent for bolusing through a feeding tube even after adding additional liquid.",[]
"We have used the Cuisinart I purchased when they were first introduced to the USA, which worked well but was inconvenient for on-the-spot use and for travel.",[]
"I read the reviews for this and other mini Cuisinarts and decided to try the ""cheaper"" one.",[]
"I am impressed with its performance, ease of use and compact size.",[]
It is clearly worth the small price I paid.,[]
I most like the ports in the top for slowly introducing liquids.,[]
"It is perfect for my intended use, and I can envision how to use it in cooking.",[]
I highly recommend it.,[]
"Great looking mini-processor, but not big on power.",[]
The shiny chrome showcases fingerprints;  it's hard to keep clean.,[]
"I have smaller and larger Cuisinart choppers, but the small one is too small for some jobs like salad dressing, mayonnaise, etc.",[]
etc and the large one....it's great for larger jobs.,[]
I LOVE this one.,[]
"It's right in the middle and keeps me from having to clean up the ""big boy"" and really does anything the small one can do...better.",[]
I love it.,[]
This is a great product.,[]
Works well.,[]
Good sizeand easy to clean.,[]
"I have only used this processor three times, and now the blade assembly is cracked.",[]
"A new blade assembly ( my processor is out of warranty ), with shipping, is $16.90, but the complete Cuisinart mini processor new, with free shipping from Amazon, is just $29.99.",[]
This Cuisinart mini processor is just CHEAP JUNK !!,[]
The motor on my unit also smells of overheating with just light chopping.,[]
This is most definitely a DO NOT BUY appliance !!,[]
"I will buy another processor, but NOT another one of these, and I will do my best to avoid Cuisinart entirely !",[]
I bought this to replace a Black and Decker mini processor that finally gave up the ghost (the plastic chopping bowl fell apart).,[]
"The mini Cuisinart is really nice, and I like it a lot more than the B&D I had.",[]
"Chops very evenly, easy to clean.",[]
Very happy with purchase!,[]
"Love my Mini-Prep Cuisinart, use it almost daily preparing my carrots, celery, onions, and whatever else I'm including in my salad.",[]
You've never eaten a salad until you've used this little jewel and finely chopped your veggies for your salad.,[]
"Olive Oil and Balsamic Vinegar, ummmmm!",[]
"The flavor is exquisite.Cuisinart DLC-1 Mini-Prep Food Processor, White",[]
A little less quality from what I have grown accustom to from Cuisinart But what can you expect for $30 these days.,[]
It does it's job,[]
"I LOVE THIS LITTLE CHOPPER FOR ONIONS, GARLIC AND OTHER SMALL JOBS...I HAVE THE LARGE PROCESSOR FOR THE BIG JOBS.",[]
GOOD PRICE...EASY TO WASH.,[]
"Perhaps that is par for the course for these types of food processors, but I was a bit surprised to find that many things have to be chopped into 1/2 inch size pieces before you put it into this Mini-Prep Food Processor.",[]
"I can dice an onion into uniform 3/8 inch pieces and clean the cutting board and knife in less time than it takes for me to dice them into 1/2 inch pieces and then put it in the processor and make a shredded pile of onions, and then clean out the processor or put it in the dish washer.",[]
"I'm sure there are things that this does that I can't do or faster than I can do it, like grinding spices or coffee, but I already had a coffee grinder.In summary, I'd still give it a 4 because it is made well, and is versitle, and finely minces things faster than I can with a knife, without losing fingertips:)",[]
I love it.,[]
Its just great.,[]
I would buy it again.,[]
I bought himalyan crystal salt and it grinded it up for me perfectly.,[]
Now I can sprinkle it while i'm cooking with ease.,[]
"I Purchased this Small Food Processor to Not only be able to Chop Nuts and Veggies, But also to Chop Meat, Yes Meat.",[]
"We tried 2 Other Smaller Units and when you would put Chopped Steak in them--the Blades would Jam.This Unit allows me to Take Steak--Cut it into Chunk Size Pieces and Puree it, For my Dog.The Motor Rocks--and there is no where else to Look for a Quality Smaller Food Processor.",[]
"Lets Face it, Cuisinart Actually Invented the Food Processor.",[]
"I bought this item since it has a very good review by costumers, however, the processor I received does not turn on.",[]
It seems its motor does not work.,[]
So I paid like $30 for it and I could not use it even for 1 second.,[]
Maybe it's my bad luck but I feel it is my responsibility to inform such problem may occur to you too.,[]
This mini-food processor is exactly what we were looking for.,[]
"Amazon, as usual, was prompt and thorough.",[]
"The processor works great and is listed as ""Cuisinart DLC-1 21-Ounce Mini-Prep Food Processor, White"".",[]
I was curious why this product got some single star reviews.,[]
I can only conclude that the users of this item didn't RTFI (read the following instructions).,[]
"Chopping onions and garlic was a snap when utilizing the instructions provided, which consisted of using the low setting and pulsing until the desired size was achieved.",[]
I'm very happy with the performance of this mini-prep and for the price it is an outstanding buy.,[]
"Oh, and the complaint about having to chop food items up before putting them into the mini-prep is without culinary merit.",[]
"If you've every had to mince garlic or onions or fruit to prepare a meal then having to make a few 1/2"" chops wouldn't be an issue.",[]
I'll take making a few cuts at an onion over having to mince one by hand any day of the week.,[]
The mini-prep minces so well that it really takes a lot of the manual labor out of preparing a meal to cook for the family.,[]
"Wife love this product, she uses it almost everyday.",[]
Unit is small enough to fit nicely on counter.,[]
Price was ecellent,[]
I have purchased a few different brands before & they never diced up my veggies as good as this one.,[]
Only cut back is the NOISE!,[]
It sounds like I'm drilling a hole in my wall.,[]
So LOUD!,[]
"I love this Mini-Prep Processor, it works fabulous and gets a very nice smooth texture to the baby food that I have prepared thus far, potatoes, apples, carrots, avocado and peaches!I have also experimented with making thicker foods as my baby graduates to chunkier food and it works superb for that as well!Very happy with the product and I saved a bunch of money by not purchasing a BABY FOOD PROCESSOR like the baby bullet!",[]
Would buy again without a doubt!,[]
This is one dumb @#$% item I've bought on amazon.,[]
The only thing it can do blend water with water.,[]
Its so slow and the motor can't take the smallest of loads.,[]
"It's such a piece of junk that though I forgot to leave a review when I bought it, ( I bought this item in may'07) I'm still taking the pains to leave one now.",[]
haven't used this but a couple of times.,[]
"I got it to chop nuts finer, but not into flour etc.",[]
"I pulsed, but the bottom chops the nuts too fine and the top not fine enough.",[]
I am trying to say not 'uniformly'.,[]
But May be great for other foods.,[]
"Compared with many others on the market, this one has a compact, simple and functional design.",[]
"The one we had for 5 years just died, so we're replacing it with another.",[]
"It got hard, daily use.I just wish it was made in the USA.",[]
I would have paid twice the price and it still would have been worth the money.,[]
"This product doesn't chop well at all, there is always chunks of whatever you are chopping left over.",[]
Save your money and buy a different chopper!,[]
This little unit is just what I needed.,[]
Very easy to operate.,[]
The size is perfect and takes care of all the chopping and processing I need done.,[]
And the black & chrome finish looks very smart on my kitchen counter.,[]
This is the greatest tool.,[]
"If you only have one small appliance, this is the one.",[]
Especially useful for one or two-person households.,[]
I've had one for five years and am about to buy another.,[]
Makes a great shower gift!,[]
We bought this food processor to prepare food for our baby daughter.,[]
"So far, the food processor has worked great!",[]
We've used it every morning to puree bananas.,[]
"The size of the processor is great for small amount of food, which is perfect for our purposes.",[]
I highly recommend this product!,[]
"This little baby is a must for any kitchen, from making salad dressings and marinades to salsas.",[]
Just big enough that I use it for most of my food processor chores; rarely do I need to take out the big processor.,[]
Once you try it you'll be hooked!,[]
"I purchased this in March, but didn't have a use for it till now, well now it's as if there is NO MOTOR!!!!",[]
It doesn't work!,[]
I tried and re-tried and NOTHING!,[]
Not sure if there is anything I can do cause it was purchased with a gift card?????,[]
?,[]
the product is great for what i needed.,[]
"i am tight for room because i am deployed to afghanistan, it took a little longer to get here then i thought but i really have no complaints about the product.",[]
it works amazing for what i needed it for.,[]
