I did buy the scented garbage bags and have had no problems so far even when I don't empty it for days.,[]
My daughter is going on 3 months and has had some pretty dirty diapers but so far no odor problems.,[]
My mother and aunt also commented that they liked it better than the Diaper Jeannie that my sister in law has.,[]
"I chose this over the Diaper Genie b/c I don't have to spend anymore money for ""special"" bag refills.",[]
I can easily use all my plastic grocery & shopping bags.,[]
Just empty the DC often & voila!,[]
no stinky diaper pail.,[]
"Also, a little Lysol spray doesn't hurt either.",[]
I do recommend being careful when opening & closing the Diaper Champ to empty it.,[]
I have broken several nails & hurt my fingers when opening it & it has startled me & the baby when it slams shut.,[]
"I was going to buy the Genie but, read all the reviews and decided on the Champ and I am so glad I did!!",[]
It is so easy to use and takes any kind of bag.,[]
So all you pay for is the Champ and not extra money on refills.,[]
I'd rather spend my money on other things not on refills for 2 years.,[]
It also does a great job at keeping the smells locked it.,[]
A great buy for any parent!,[]
"At only 3 weeks old, my son goes through about a dozen diapers a day.",[]
We have the diaper champ in his bedroom and it's been great so far.,[]
(We'll see once he switches to solid food and his diapers are a bit more stinky!),[]
It's so easy to use and you don't have to buy the special bags.,[]
We've used kitchen trash bags as well as large plastic shopping bags like the kind you get at babies r us.,[]
One recommendation - get a can of Lysol and spray the diaper champ down when you change the bag.,[]
"Overall, I love this diaper pail and would buy it again in a hearbeat!",[]
I was going to get the Diaper Genie which I had with my daughter but saw the Diaper Champ and the store.,[]
A lady walking by stopped and recommended it to me.,[]
I put it on my registry and received it.,[]
I love it.,[]
"The chute will get dirty if you have anything dirty going in it but if you can not fold a dirty diaper up, just wrap a baby wipe around it before sending it into the Champ.",[]
I did not clean mine for 4 months and decided I should (although it did not stink) It came apart great.,[]
All you need is a Philips screw driver.,[]
I got the handle apart and was able to see what makes this wonderful pail work.,[]
I filled it with Bleach and water and hosed it off in the yard with the water hose.,[]
I then sprayed it down with Lysol and let it dry upside down on a towel.,[]
The only smells I have are the ones in the room from changing the diaper.,[]
"Once I get rid of the diaper in the Champ and a few minutes go by, the room is back to it's regular smell.",[]
To fit as many diapers as possible in it I fold them up real tight before putting them into the Champ and I shake the pail a little so they are spread out in the bag.,[]
I really love this pail!,[]
I think this thing is great.,[]
"Although I just bought mine, I like it much better than my diaper genie.",[]
"THOSE things are confusing, not this thing.",[]
"You don't have to worry about if you twisted the top enough times, tying knots in the plastic liner before the diapers go everywhere, how to cut the plastic, spending ""money"" for refills, etc.",[]
"You put in a regular trash bag, close the lid, stick the diaper in the hole, flip the handle, and you're done.",[]
"When it's full, (geez it holds a lot!)",[]
"open the top, grab the bag, and throw it all away.",[]
"Did I mention, a bag?",[]
"A real, inexpensive, run-of-the-mill trash bag!",[]
"Believe it, folks!",[]
"With all the refills you buy for the other diaper disposal, you could buy 20 Diaper Champs.",[]
Clean the thing.,[]
The whole thing.,[]
"Hey, it's worth it!",[]
"Don't be lazy, and your nursery won't stink!",[]
"We expect diaper disposals to be able to feed and raise our kids, plus wipe peanut butter and jelly off the walls.",[]
Nothing is going to be completely odor and work-free.,[]
"Great purchase, definitely reccommend.",[]
Glad Odor Shield trash bags will definitely keep the odor out of the Diaper Champ.,[]
I ran out of the Odor shield trash bags and could definitely tell the difference.,[]
I now keep extra stock.,[]
"We've been using the Diaper Champ for about 4 months now, and have had NO problems whatsoever!",[]
The design is absolutely ingenious and the fact that it takes regular trash bags is a definite plus!,[]
"We bought a box of Hefty Trash Bags with that odor patch to use in the Champ and we change the bag about 2-3 times a week, and we've have had no problems with smell.",[]
"I usually wipe the Champ off with a Clorox Wipe each time I change the bag, but my husband decided to take apart the Champ a few weeks ago to give it a thorough cleaning with some bleach water, and he mentioned that the gaskets were looking worn out.","[('champ', 0.12431294196997547)]"
"So, I called Baby Trend (Diaper Champ manufacturer) and they sent me to two new gaskets and two new piston rings (which I didn't even ask for) for FREE!",[]
"The customer service rep. even told me to call and request more gaskets and rings when we notice that the new ones start to wear out, usually after about 6 months.",[]
"Overall, I am very pleased with our purchase.",[]
I love my Diaper Champ.,[]
"My son is 9 months old and I have not had any problems with it.Yes, when it gets full it doesn't close so well, CHANGE THE BAG.It can smell a little when it is full or hot,  CHANGE THE BAG.You can fit more diapers if you really wrap the diaper tight with the tape.I use deoderant bags and they are great.I have four other friends that have recently had babies and I have suggested this to all of them.",[]
"We're expecting our first in June, and so while shopping/registring have been relying on recommendations from friends and the product reviews on this site.",[]
"We had been considering the Diaper Champ, and hoped that it would live up to the accolades we'd read.",[]
"We actually got a chance to try it out:My mother recently had a stroke, and as a result, she wound up with some incontinence issues.",[]
"We got her some pads to deal with it, which solved one problem, but then presented another: the smell.",[]
"Since we'd been considering getting a Diaper Champ for the baby, I thought this would be the perfect opportunity to try out it's ability to keep the nursery from smelling like a dirty diaper.We've been using it for my mom for about a month now and I have to say the smell problem has been solved.",[]
"Sure, it's no fun when you change the bag, but for the few seconds of breath-holding while you whip that sucker out and tie it off...",[]
I think it's worth the money you save from not having the special refil packs.,[]
"Plus it's super easy to use with the one-hand operation -- just drop it in, flip the handle and you're done.I highly recommend it for anyone who's concerned about containing the smell and avoiding the expense of those refil packs.",[]
My biggest concern was would this truly control the odor and yes it did...dirty diapes and soaked diapers.....I only noticed an odor one time and that was because I did not close thelid when I changed out the bag.,[]
No need for deodorizers.I use the regular kitchen trash bags and it is so easy to empty...even did while daughter sleep and no noise!,[]
I use the scented bags and even if I don't no smell!,[]
This holds alot and does not take up alot of space.,[]
At first we were pleased with the Diaper Champ because of its easy-to-use function and the fact that we did not have to buy special refills or bags.,[]
"However, we quickly learned that the biggest drawback to the Champ is its inability to seal in odor.",[]
"We frequently empty the bags and clean the pail (including Lysol, chlorine bleach, and anti-bacterial wipes) but have found the odor to be overwhelming and ever present regardless of disinfectant or frequent bag changes.",[]
"Recently in a popular parenting magazine, they reviewed various diaper disposal systems and used Limburger cheese (a very potent and stinky cheese) to measure odor levels among the various systems.",[]
Diaper Champ received the worst rating for odor (4 cheese wedges indicating the worst odor rating possible.),[]
"I would avoid the hassle, spend a few extra bucks and get one of the other, higher-rated and popular systems.",[]
This diaper pail is so easy to use.,[]
It doesn't smell and is easily one of the best baby products that we own.,[]
The best part is that we were able to use regular trash bags.,[]
I highly recommend this over any other diaper pail in the market.,[]
"Thank goodness we found something better and easier than ""genie""!",[]
"!This one works great, no difficulty loading bags or putting diapers in.Only reason for not 5 stars is a little odor escapes but in my opinion well worth the offsetting ease of use.",[]
"We didn't want to spend a fortune on a diaper pail and refills, so we opted for the Diaper Champ.",[]
We absolutely love it.,[]
We have used it for three months now and have had no problems with smells of any kind.,[]
"Best of all, you can use any kind of bag, including reused plastic grocery bags!",[]
I registered for the diaper champ when I found out I was pregnant.,[]
I knew that I didn't want the genie because I didn't want to invest in those refill bags.,[]
"With the champ, I can just put a regular trash bag in it and save a bundle.",[]
And the one handed handle action is great when you have a wiggling baby in your other arm.,[]
I would suggest the diaper champ over the diaper genie to any expecting mother.,[]
You'll be glad you bought it.,[]
"I'm a first time mom, so of course I knew nothing about diapers and diaper pails.",[]
Several friends recommended the Diaper Genie but I took a shot in the dark and registered for the Diaper Champ - boy am I glad I did!,[]
I like the fact that you can use any kind of bags and the diaper disposal is so easy.,[]
I knew it was a winner when my husband was impressed.,[]
"So impressed, he even changes the bags (which we do every 2 days or so).",[]
"I'm starting to notice a slight odor, but that's only when the bag gets full.",[]
"My daughter's diet is changing, so I'm sure the ""odor"" will only increase, but it's definitely better than throwing the messy diapers in the trash.",[]
"To those who are unsure about which diaper pail is best, try this one - you won't be sorry!",[]
I had checked into all of the pails before I had my little girl.,[]
"I heard great things about all of them, but wanted what would be most cost effective for us.",[]
"When we decided on the diaper champ, we won!1.",[]
No refills to every buy.,[]
you can use a standard trash bag and you don't have to spend the extra money for those refills.2.,[]
I empty mine once a week on trash day and it is full.,[]
"However, there is never a smell eminating from my champ.3.",[]
No stinky smells in my home.,[]
"Even though my daughter is only 2 months old, she has some of THE stinkiest diapers I have ever smelt!",[]
"But, there has never been any leakage of smell and it does not stink when I open it to change it.4.",[]
I clean it every other week with Clorox wipes and they keep it nice and fresh.,[]
"Since those stinky diapers camp out in there for a week, it needs to be freshened up every now and then.Verdict:Get the champ....it will save you tons in the long run!!",[]
!,[]
This is a waste of money.,[]
No matter what you do it still smells!,[]
Also very hard to clean!,[]
"It is neat that you can use your own bags, but the concept of the bag sealing like the diaper genie when you put it in seems like it would work better.",[]
My suggestion would be not to throw diapers in the trash cans inside the house just tie them up in a plastic sack maybe even a sented one and throw it away in your trash can outside to emliminate smell!!,[]
"b/c not matter what you do if you put dirty diapers inside ANYWHERE they will smell, even when using this!",[]
!,[]
This diaper pail is so much better than the diaper genie!,[]
You just drop the diaper in the chute!,[]
I have had it for 5 months and there is no odor (I keep it in the bathroom).,[]
The d.g.,[]
I had with my first child was only used a month or so and then I just used the outside trash because it was such a pain.I only gave it 4 stars because it is hard to open (I've also broken a nail trying to do it) and I wish the top unhinged all the way; it has a tendancy to slam back shut.,[]
"Other than that, it's great - no special bags to buy; no cutting when you need to change the bag,  - do yourself a favor and get this over the d.g.",[]
I am giving this Diaper Champ 4 stars instead of 5 only because I have trouble opening it to change it.,[]
"Now before that discourages you, it is only fair to say I also have trouble openning our child safty gates too, and you don't want your toddler playing in here once they are mobile!I have read other reviews where customers have been disapointed that there is still a dirty diaper smell with this product.",[]
"I will say that as long as you are changing the pail before it is overflowing this is usually not the case for me and often when the pail is crammed full the smell is from an ""over achieving diaper"" that has come open and messed the openning a bit.I have been pleased with this product and would definatly purchace again.",[]
"The pail locks tight against curious toddlers, it uses regular garbage bags instead of expensive inserts like the diaper genie that really don't keep the odor locked in any better anyways, and it is easy to use.",[]
"Just throw your folded up diaper in the openning on the top and flip the handle the other way and its gone (one thought here that I should note...I have had to fish ""Pink Bunny"" out of the Diaper Champ a few times during nap time...so consider this too when easy to use is a factor in your purchace.","[('openning', 0.096633526209691)]"
"If it is easy to use, your toddler may toss their toys in there for entertainment and howl for you to get them out.",[]
)All and all I think this is the best diaper pail on the market.,[]
Pink Bunny adventures and all;),[]
My baby is 1 month old now and we have been using the diaper champ since day 1.,[]
"It is ultra convient when you have your hands full with a dirty diaper and a kicking, squirming wiggle worm.",[]
"There has been no smell at all, and the champ's generous size allows plenty of diapers, which is important because it seems as though there is no time to do ANYTHING!!!",[]
I would recomend this product to any and all people with babies.,[]
We have been using this for about 6 months now for our baby girl.,[]
This is better than some of the other ones we have tried since some use too much bags and others are too complicated one handed.,[]
"You also use your own garbage bags, not some over priced special ones.This one is great!!",[]
One hand to drop the diaper in and then flip the handle.,[]
"If you think it has a smell, drop in one dryer sheet and you won't notice anything!We really recommend it!",[]
!,[]
I chose the Diaper Champ over the DIFFICULT to use Diper Genie!Diaper Champ is easy to use.,[]
"One handed disposal, no need to purchase ""special"" bags or deordorants.",[]
The smell refered to by others is really no worse than when you change a full diaper.,[]
It is the safest pail I've seen.,[]
NO RISK OF DROWNING HERE!,[]
"The latch is ""childproof"" so it takes a little practice but its well worth it",[]
I previously owned a Diaper Genie and also didn't like the idea of buying liners and how few diapers it held.,[]
When I saw the Diaper Champ I thought it looked great.,[]
"Don't let the base fool you, it is much smaller on the inside for holding disposed diapers.",[]
"Also, I kept thinking my son had a dirty diaper, when in fact it was the Diaper Champ I was smelling.",[]
"The Diaper Champ is residing in the garage after only 3 weeks of use, and I purchased another Diaper Genie, which I think ended up holding just as many diapers as the Diaper Champ.",[]
I love this product - it is very easy to use and there is no odor at all.,[]
I am still breastfeeding my son so I don't know whether the odor is going to kick in when he starts solids.,[]
"At this time, I am very satisfied with the Diaper Champ.",[]
I highly recommend this product - you can practically use any plastic bags - we just use the shopping bags we get from stores.,[]
I changed my registry from the Diaper Genie to the Diaper Champ after reading the reviews for the Diaper Champ online.,[]
I'm very happy with it.,[]
Our baby's cradle is in our room so we keep the Champ in there with us.,[]
There are no odor problems whatsoever.,[]
I also love that you don't have to buy specialty bags for this pail.The only caution I give is to moms with long natural or fake nails...the opening latch doesn't release very smoothly.,[]
"When releasing the latch (which is, wonderfully, a one-handed job, although it can be a tad bit difficult to squeeze), it springs open rather sharply.",[]
"I have short nails but I can imagine long nails might get broken or fake ones snapped off if care isn't taken when opening the top.Also, the diaper disposal mechanism, which is great (!!!)",[]
"since it really keeps the odor inside the pail, can be a little loud as it slides down into the pail, especially in the quiet hours in the middle of the night when you're trying to get baby back to sleep.",[]
"Just be sure to dispose of your diaper(s) before putting baby down to sleep.I would recommend this product to everyone, even with these two very minor issues.",[]
"When my wife and I got the Diaper Champ, we thought that it would work perfectly.",[]
"We read the reviews on and saw that people liked it much better then the Diaper Genie, but I'm not 100% sure.",[]
"We found that when you put a dirty diaper into the top loader, there was a tendency to get streaks which would then get on the plunger which would then have to get cleaned each time it was used.",[]
We resorted to using small plastic bags to store the dirty diapers and dumping them in a trash can and using the Diaper Champ for wet diapers only.,[]
We also had a problem with diaper wipes getting caught when the top was flipped.,[]
This eventually ruined the foam pad that is applied to the flip top to keep odors in.,[]
I had to go and pull the crumpled foam out just so we could turn the lid.,[]
"But like I stated, its better then a trash can, but I'm not sure if its better then the Diaper Genie.",[]
"We decided on the Diaper Champ, partially by recommendation from a friend, but also because of the convenience of not having to buy refill bags.",[]
"We just use grocery bags or...bags, and have been pleased with how well it works.",[]
"Once your baby starts having really stinky diapers, it's a good idea to try to empty it every day or every other day ... or else the odor can start to fill the room, but even then it's not a terrible odor.",[]
"It's so easy to use, and well as easy to change the bag.",[]
"I just keep a can of Lysol nearby ... when I change the bag, I just spray the Champ with Lysol, and let it air out to help with the smell inside the can.",[]
I have been using the Diaper Champ for now 8 months.,[]
"At first, I was like everybody else, I loved it and thought it was the greatest pail out there.",[]
I made my sister switch from the [other pail] to the Diaper champ and recommended it to all my friends who had babies.,[]
Then a few weeks ago it started to smell.,[]
It seemed like every time the Diaper Champ got at least half full it could not contain the odors anymore.,[]
So I contacted the Customer Service at Baby Trend and explained to them what was going on.,[]
Within one day they replied to my e-mail.,[]
It seems all I need is a new gasket!!,[]
(which they are sending me).,[]
Not only was Customer Service really prompt and efficient but the problem also seems really easy to fix.,[]
Easier than running out to get a Diaper [pail].,[]
"I still say the Diaper Champ is the best out there and I have enjoyed 8 month of nice, clean  smelling baby nursery!!!",[]
Even if the gasket does not fix the problem I will still go and get another Diaper Champ.,[]
At least I know I'll have eight month where I'll breathe clean air...,[]
We registered for the Diaper Champ bc it is large enough to accomodate a large number of diapers and you can use your own kitchen bags rather than buying expensive refills.,[]
Our only concern was whether it would really hold in the smell.,[]
We have not been disappointed!,[]
You can't smell the diapers AT ALL!,[]
We do use odorshield kitchen bags just to make sure bc we have it in a main room in our home.,[]
"It holds a lot of diapers, so you're not constantly changing the bag.",[]
"It is easy to use, fairly inexpensive, and works great!",[]
I highly recommend this product.,[]
"Simple design, easy to use, keeps odor contianed very well.",[]
Much better choice than others out there.,[]
I LOVE this diaper pail!,[]
It's easy to change out and doesn't emit any odor!,[]
It seems like we change diapers all the time and it holds so many!,[]
I recommend this over ANY pail to anyone.,[]
This is the BEST diaper pail I have ever heard or seen.,[]
It hold a lot of diaper's without a smell of any kind.,[]
I keep an extra bag in the bottom and Lysol next to it.,[]
The only smell it when you change it but it goes away the instant the top is closed.,[]
I heard only bad things about the Diaper Genie and decided that I didn't wanna even mess with it so I registered for this.,[]
Before the baby was born my husband used it to put the dirty cat litter bags in it to test it and after 1-week there wasn't even a smell from that.,[]
It's very easy to use.,[]
I couldn't ask for better.,[]
I researched which diaper pail was better when i was pregnant with my first.,[]
This one seemed to have the most positive reviews so i added it to my registry.,[]
"I got mine 3 1/3 years ago and i'm still using it (going on baby #3).I like the fact that you can use regular trash bags, even the cheap ones!",[]
It's very convenient to use as well.,[]
Lifting the lid can be a little tricky if you have long nails but it's not a big deal once you get used to how it works.The only thing i recommend is to make sure you wash it out and sanitize it at least twice a month because it will eventually starts to smell if not.,[]
"And if you have two kids in diapers like i do, it fills up fast and I have to change the bag twice a week.",[]
With one baby i only had to change the bag once a week.It is now 2008 and i've had 2 more children (4 total) since I originally wrote this review.,[]
I am still using the same Diaper Champ and I still highly recommend it!,[]
"I started off with the Genie but quickly realized that I had to keep buying the special, pricey Genie bags.",[]
"The Champ is great, takes any appropriate sized plastic bag and contains stinky diaper smells well.",[]
A MUST have!,[]
This is one of the things I can't live without.,[]
There are no bad smells until you open it.,[]
Using regular garbage bags is a huge money saver and there is plenty of room for tons of diapers!,[]
Plus it can also be used as a trash can!,[]
The diaper champ is the best!!!,[]
Having used it with 2 children 13 months apart...I can honestly speak to its worth!,[]
"I have tried other pails, but none have compared positively to the Champ.1) The champ is easy to use.One pail that I used was so difficult to change the bag and insert the dirty diaper.",[]
You had to remove the entire lid and lay it on the floor (which led to my toddler running away with it which is gross) while trying to fit the bag correctly into the slot.,[]
"For diaper disposal, you had to push a button and the lid would or would not pop open.",[]
With the Champ all you had to do was drop the dirty diaper into the opening and flip the lid.,[]
It was so easy my toddler would dispose of her on diapers.,[]
The Champ also has hinges for you to place a new bag.2) The Champ uses regular store bags.You do not have to waste money or time trying to purchase special bags for the Champ.,[]
You can save your bags from your shopping trip and insert them into the Champ.,[]
"Special bags are expensive, hard to find, and you never have enough.",[]
This will never be a problem with the Champ.,[]
Don't Caregivers need more simplicity in their lives?,[]
The Champ gives you peace of mind and wallet.3)The Champ is Odor Free for at least 15 months.The Champ did not start letting a little odor through until well over a year.,[]
I cannot speak to the accuracy of its odor containing capabilities due to it was working overtime with 2 childrens diapers.,[]
If you have only one child the Champ may last you until the child is out of diapers.,[]
The other pail I used started to smell after 2 weeks  of use.,[]
"Regardless to this fact, I believe the Champ is the best way to go.",[]
The positives outway the negatives.,[]
There probably isn't a pail out on the market that doesn't get smelly after a while.,[]
Let the Champ win you over!!,[]
!,[]
"I originally loved this product when I brought it home from the store, so much so that I gave it 5 stars after using it for 3 months.",[]
I even bought one for my brother after the birth of his son.,[]
Well here's the REAL DEAL...,[]
It worked quite well for about 4 to 6 months.,[]
"However, now that I've had it for about 3.5 years, it's ""smellfully"" obvious it doesn't work as designed.I've removed it from the nursery and redeployed it to the guest bathroom.",[]
"To handle the odor that leaks from the champ, I have use the following workaround.",[]
I've purchased Diaper Bags (Sassy Bags) from Wal-Mart/K-Mart and place every soiled diaper in the bag before depositing it into the Diaper Champ.,[]
Wet Diapers are placed in the Champ without having to be placed into a bag.,[]
Why does it leak odor?,[]
