I will probably throw the darn thing away...we'll be potty training soon and won't need it for much longer.,[]
"Besides, we take the regular trash out about once a day anyway.",[]
It was a great diaper pail until then!,[]
!,[]
We refused to buy the Diaper Genie because of the mandatory refill bags-too much money !,[]
The first diaper pail we had was nowhere near as good.,[]
"The top opened to put the diaper in and you could see right in, ie, smell right in.",[]
My toddler could flip the lid and ended up breaking it.,[]
We bought the Champ 2 months ago and it paid for itself right away.,[]
"A little hard to open until you get the hang of it, but other than that, it's great.",[]
My toddler even puts her diapers in and I never have to worry about her getting inside the pail.,[]
There is NO WAY she can open it.,[]
It's wonderful !!!,[]
I also buy the kitchen bags from the dollar store and we usually use 2 bags a week.,[]
Definitely the best !!,[]
!,[]
This is a fine product and I am happy with it.,[]
"I clean it weekly and since my daughter is on formula now, I never put poop diapers in it and therefore it never smells bad.",[]
My favorite thing is that you can use any plastic sack store bag.,[]
My only complain is that the part that you hook the bags to doesn't connect to anything to hold it up when cleaning.,[]
"Great size, we only change each week but after 5 months the smell started to seep through and the nursery after 8 months is smelling too much of diapers now, despite airfreshners etc.",[]
"If my baby used this as a bedroom, he sleeps with us I would have replaced this sooner !!",[]
I even washed it all our in bleach but the seals must have gone as its just getting worse.,[]
I like the size though and love the fact you just put the diaper in dirty and swing the top over.,[]
One problem with this is when it gets full the diapers get stuck - thats not very pleasent too.Going to BabyRUs this morning as after 8 months I decided today is the day its ready totally for a new one.,[]
"We decided to go with the champ just because you dont have to buy those expensive refills, boy and i glad we did!",[]
"I buy CHEAP scented trash bags and change it every three to four days and have had no problems with the smell and my son eats solids and his diapers are pretty gross, as long as you CHANGE THE BAG you will love this it really is the CHAMP OF DIRTY DIAPERS!!!!!",[]
!,[]
We absolutely LOVE the CHAMP!,[]
It does a great job of keeping diaper odor out of our son's room.,[]
We love that it uses regular trash bags and so we are not spending more money on Genie refills.,[]
We have emptied it about once or twice a week so far (our son is 5 months) and that has been enough.,[]
"If there is a super stinky diaper, we just seal it up in plastic grocery sacks and put it in the big trash can in the garage.",[]
"It is impossible for any diaper pail to lock out all stinkiness.Also, for the complaints that the champ is difficult to open:  I would rather my son not be able to get it open than have a pail that is too easy to open.",[]
"Well, no one in my family can figure out how to use the diaper genie.",[]
"With two babies born within 3 weeks of each other, my sister in law and I decided to try the diaper champ.",[]
Her Aunt sent her the diaper genie and none of us can figure it out.,[]
The Champ is so easy!!!,[]
No expensive refills!!!,[]
We have not noticed any smells and a Wal-Mart bag can hold a lot.,[]
I would change the bag often to avoid overfilling the bag abd having diapers get stuck.,[]
"Overall, this is the best baby accessory we own!!!",[]
!,[]
I am really disappointed with the Diaper Champ.,[]
"It worked great at first, but then the foam seal broke and it wouldn't contain the smell.",[]
Babies 'R Us gratiously exchanged it for another one and it happened again.,[]
I would say it's a product default.,[]
"We always made sure the tape was tucked in, etc., but the foam liner just kept coming out.",[]
"Plus, sometimes when the diaper was really heavy and big, like in the morning when they're soaked, it wouldn't fit in the chamber and turn properly, so we'd have to jam it in there, gross!Otherwise, the champ worked well on odors and accepting diapers.",[]
I'm pregnant with baby #2 and will look into other diaper pails.,[]
I bought this as a gift for a friend's baby shower and they really adore it.,[]
It's a great invention and they've really put it to good use after the baby was born.,[]
This thing really hits the mark!!!,[]
"Inexpensive, economical, effective and super easy to use!",[]
!1 The best part about it is it uses REGULAR kitchen bags.,[]
No special bags or canisters.We really love this diaper system... And if any diapers dirty the unit while your loading just simply wipe it with a wet wipe and you are back in bussiness!,[]
!This one really does Knock Out The Competition!,[]
!Update 7/30/05 - So far has performed like a champ.,[]
"Using normal bags is a big plus!Having only had breastfed poopy diapers (which aren't as smelly as regular poopy diapers) in this up until now, i really cant' comment on its complete and total efectiveness against really stinky poops, but for the breastfed diapers it has been low or no maintenance and odor free!Easy to use, inexpensive and odor free are why this reviewer feels that the Diaper Champ, for now, still stands as an Undefeated Heavyweight!","[('odor', 0.10955683499513391)]"
!,[]
"I TRIED A ""DIAPER CHAMP"" FOR MY SECOND BABY.",[]
I BOUGHT THE DIAPER CHAMP BECAUSE IT USED REGULAR TRASH BAGS AND I THOUGHT THAT WOULD BE MORE ECONOMICAL THAN THE PRICEY DIAPER PAIL REFILLS ON OTHER DIAPER PAILS(I FIRST USED A DIAPER GENIE OVER 12 YEARS AGO WHEN THEY WERE FIRST OUT.,[]
I DID NOTICE SOME ODOR BACK THEN BUT BEING AN EXHAUSTED FIRST TIME MOM I PUT IT DOWN TO ME NOT CLEANING THE PAIL...HEY THE INSTRUCTIONS DID NOT SAY TO DO THAT AND I FIGURED THE POOPY WAS IN THE BAG ANYWAY)....BACK TO THE CHAMP...,[]
THE DIAPER CHAMP DID GREAT...AT FIRST - I EVEN CLEANED IT WITH ANTIBACTERIAL WIPES IN BETWEEN EMPTYNG THE THING.,[]
"BUT ALAS THE DAY CAME WHEN MY BABY HAD TO START SOLID FOODS, AND THE STINKIES GOT STINKIER, BY THE TIME I WEANED HER ONTO FORMULA AT NEARLY 9 MONTHS OLD THE DIAPER CHAMP HAD SEEN IT'S LAST DAYS.",[]
THE STINK WAS SO BAD MY HUSBAND AND I PLAYFULLY ARGUED ABOUT WHOSE TURN IT WOULD BE TO EMPTY THE THING!,[]
WE BOUGHT A DIAPER GENIE IN HOPES THAT WE COULD BANISH THE STINKS.,[]
AT THAT POINT THE PRICE OF THE REFILLS BECAME OF NO OBJECT...THE POOPY DESIGNER ROOM FRAGRANCE HAD TO GO.....THE DIAPER GENIE LASTED ONE DAY IN MY HOUSE.,[]
THE STINK WAS WRETCHED EVERY TIME WE OPENED THE TOP TO LOAD A DIAPER IN....AND IT WAS EVEN STINKIER EMPTYING THE QUARTER-FILLED PAIL......ALL IN ALL A MAJOR DISAPOINTMENT....DON'T BOTHER WASTING YOUR CASH ON A GENIE....STINKY AS IT WAS WHEN EMPTYING I AM BACK TO THE DIAPER CHAMP....AT LEAST IT DOES NOT SMELL WHEN I PUT A DIAPER IN.,[]
I GAVE IT 3 STARS BECAUSE IT JUST DOES NOT DO THE JOB ALL THE WAY.,[]
"I CAN SOMETIMES SMELL THE POOP IN MY DAUGHTER'S ROOM, ESPECIALLY IF THE DOOR WAS CLOSED, BUT IT CERTAINLY IS NO WORSE, AND IN MY BOOKS SOMEWHAT BETTER THAN THE GENIE",[]
"As a first time mother, I wanted to get the best for my daughter.",[]
"I shopped around a lot, and asked a lot of questions.",[]
"While at someone's house, I saw the Diaper Champ.",[]
It was one that I hadn't seen very much in the various stores I shopped in.,[]
"I was immediately impressed by the ease of it, and the convenience of being able to use ANY bag!!",[]
"!When I bought it, I didn't have a chance to show my husband how to use it -- but no worries!!!",[]
It is so simple to figure out how to use!,[]
"My nephew -- a toddler, knows how to use it (without him being able to open it up!",[]
)I've even recommended it to strangers in the baby stores!You'll love it!,[]
My girlfriend said to get this and I love it.It is so easy and simple to use.,[]
"Just put the diaper in the top and flip the handle..and it's gone.You use your own garbage bags, which is great.It doesn't let the odors out.Everyone that comes to our home asks about it, when they see it..and think it's great.a must have item.",[]
We have been using the Diaper Champ for just about 9 months.,[]
We have loved it until recently.,[]
It has been great.,[]
LAtely we have been smelling diapers in my son's room.,[]
We have decided that since it worked so well that we will be buying another one this weekend.,[]
We like that we can use regular bags and do not need to buy special ones.,[]
Since this product is not too expensive we have decided to buy another.,[]
This product is awful.,[]
It does not hold odors at all.,[]
"I have read in other reviews about how you have to constantly clean and use disinfectant, etc.",[]
Why wouldn't I just use a covered trashcan then?,[]
The whole purpose of this is to keep odors out of the house.,[]
"My wife, who recently had our second child, was overcome with the smell during her second pregnancy, to the point where she never put a poopy diaper in the Diaper Champ.",[]
"We have another diaper dispoal system for our new baby (forgive me for forgetting the name), and it works great.",[]
I like the slim shape and that you can use regular tall kitchen bags with the Diaper Champ.,[]
"BUT, it really isn't that great in controlling odor.",[]
"Sometimes diapers get stuck in the ""flipping tube"" and then you have to open it and pull it out... what a mess!",[]
It isn't all that easy to clean either.,[]
I would not recommend this to anyone!,[]
Its really easy but it smells all the time.,[]
You could smell it down the hallway it was so bad.,[]
We even bought the air fresheners that you plug into the wall and it didn't improve the smell at all.,[]
I still use it for wet diapers but if there is a dirty one I take it outside to the trash can so it doesn't smell up my house.Try anything but the diaper champ.,[]
"After reading all the reviews on-line for this product I chose to register for it, now that I am using it I am disappointed.",[]
I'm not sure if my sense of smell is just that of super hero's or my daughter has super smelly diapers.,[]
"Either way her room does have the smell of dirty diapers when you enter and the ""Champ"" is in the back corner of the room.",[]
I guess I'm just grateful that the whole house doesn't smell as bad as her room.,[]
We've now had the Diaper Champ for a little over a year!,[]
We love it.,[]
It's better for the environment than other disposable diaper systems and it really doesn't smell!,[]
I highly recommend it.,[]
Drawbacks: it doesn't hold that many diapers at a time.,[]
We have 2 in dapers and we changes it 3 times a week or so.,[]
It needs to be cleaned pretty often or lots of mold and bacteria start to grow (on the parts you can't see until you take it apart).,[]
Lastly part of the fabric/plastic material has ripped on part of it so it is a bit harder to flip back in forth when you  put new dirty diapers in!,[]
"Overall, this is a great product!",[]
"Being a first time Mom, people were overloading me with advice including what diaper pail to purchase.",[]
Some said the Diaper Genie and some said the Diaper Champ and then there was another brand recommended.,[]
I did some research to see what other parents were using online here at Babies-R-Us and decided to go with the Diaper Champ.,[]
I love it!,[]
"No special bags to purchase, no odors, not too bulky.",[]
Works great and I would highly recommend this product.,[]
"After Our Diaper Genie broke after 2 years, I was advised to buy the D. Champ.",[]
It was highly recommended by a new mom with an infant.,[]
"Big mistake, her baby as well as most of the people reviewing this positively are using it with their INFANTS, so their diapers do not smell like that of a one or two year old toddler!!!!!!!!",[]
"The Genie does a much better job of masking the odors, Yes, it is more cumbersome in terms of changing out the plastic....but that I can live with.",[]
The reason I gave it two stars is the ease of use with the Champ is superior....but I simply CANT LIVE with the stinky smell of diapers!,[]
The Diaper Champ is a must have for your nursery!,[]
"I had a Diaper Genie, and that thing was horrible!",[]
"A pain to maneuver, empty, etc.",[]
The Diaper Champ is so easy to use and empty.,[]
"While it doesn't completely mask the odor of all poopy diapers, it does a pretty good job.",[]
I can't think of how a diaper trash can could realistically be any better.,[]
We put a Diaper Genie on the shower list for the first baby.,[]
We used it for 2 years and it was OK but we were fed up with it and I took a chance on the Diaper Champ for #2.,[]
"After 5 months, we couldn't be happier with Diaper Champ.",[]
Here's a short list of the main reasons I'd recommend this against diaper genie:5.,[]
Diaper Champ doesn't use expensive refills like the genie.,[]
We were going through 2-3 of those $5 refills a month with the genie.,[]
"On the conservative side, say that was $120 a year in genie refills.",[]
"With the Diaper Champ, I bought one big box of Glad Kitchen drawstring bags (150 bags) for $15 at the warehouse club.",[]
We change the bag 1-2x weekly.,[]
"The 150 bags will probably last 1 1/2 -2 years, for $15.",[]
(The Champ box says you can use plastic grocery bags.,[]
Don't.,[]
They're way too small and don't hold enough diapers to make it worth the while.)4.,[]
The Champ holds a lot more than the genie.,[]
Less frequent emptying.3.,[]
The genie was a pain to empty and even more work to change refills.,[]
"Emptying involves tying off the tiny little sausage tube bag, restarting the cut end of the refill.",[]
Pain.,[]
Changing the refill was just annoying.,[]
"When the refill runs out, there's not enough bag to tie so you are stuck holding an open end of a dirty diaper bag.",[]
I don't need that.,[]
"And at any change or refill, you have to find another bag to drop the sausage string of dirty diapers into.",[]
"With the champ, I open the lid, tie off the drawstring bag and that bag goes straight into the garbage can.",[]
The new bag goes in as simple as a trash-can liner and close the lid.2.,[]
The genie broke after about 15 months.,[]
There are 4 little plastic prongs inside that hold the diaper in place while you twist the ring to seal the diaper in the bag.,[]
The spring on one broke and it never held the diapers well again after that.1.,[]
"And my top reason why the diaper champ is champ: It's perfectly easy to use, impossible to use wrong.",[]
"Whenever we had a babysitter or family member helping while we used the genie, we always took a couple of minutes to show them how to use it.",[]
"We'd come home and every time, they'd gotten in wrong and used the cutter tool on top and cut the diaper bag like they were changing it when they just needed to put the diaper in.",[]
"No, it's not difficult to use or get right once you do it a few times but if you only use it once a month, that dial on top that turns the cutter is just to obvious to turn to ignore and impossible not to turn.",[]
Every single time someone got it wrong.,[]
"So, the Diaper Champ.",[]
you drop the diaper in the open hole and flip the handle and it's gone.,[]
"I can't think of a way anyone could do it wrong and most people who've used it so far, don't need even the simplest hint from us on how to use it.",[]
I love this diaper pail.,[]
It keeps the diapers from stinking up your room/house.,[]
I also love that I can use regualer old kitchen bags and dont' have to fork over extra bucks for special bags.,[]
The reason I gave it 4 stars is that I wish that it held more diapers.,[]
I got this pail so I wouldn't have to buy special bags.,[]
I had the Diaper Genie with my first child and the odor was too bad with it.,[]
I decided to try this pail and it has worked fine.,[]
"There is some odor, but not like the Diaper Genie.",[]
I use regular trash bags and only put wet diapers in it.,[]
This is good for the price and great that you dont have to buy those pricey refills.,[]
We bought this diaper pail for our first baby because we didn't want to have to keep buying the refills for the other diaper pails and we also heard from other people that they still smell.,[]
"So we purchased this one, and we are completely statisfied.",[]
We have it in our son's room and it doesn't smell at all.,[]
It's very easy to change the bags and it locks nice and tight.,[]
We purchase 30 gallon trash bags and they fit perfectly.,[]
But the best thing is that there is no smell at all.,[]
It's absolutely perfect.,[]
I love this product!,[]
We looked at all of the diaper pail options and finally decided on the Diaper Champ -- and am very glad we did!,[]
"The pail keeps our now 7 month old's dirty, smelly, diapers neatly contained and odor-free.",[]
The only time we smell the diapers at all is when we are changing the bag -- and we've found that using scented bags helps during this process too.,[]
"All in all, the best diaper pail product out there!",[]
We started with the Neat system and was very unhappy with it!,[]
"Thought about the Diaper Genie, but did not want to be tied down to specific replacment bags, so we went with the Champ.",[]
Al though it does not contain the smell all that well it is well worth the money to be abel to use regular bags.,[]
I use Glad Scented kitchen bags and they help.,[]
I also like the review regarding not disposing of the really smelly ones in the pail.,[]
Most regular poopie and pee diapers though are well contained and only needs to be changed once a week.,[]
On another positive note it is very easy to use and change bags.,[]
"I have never had a diaper jam or a broken nail, but you do have to open it carefully as it is tight.",[]
I love this item.,[]
It doesn't stink like the Diaper Genie and is definitely not as complicated to use.,[]
Just insert diaper and pull handle.,[]
No special bags.,[]
Just make sure that your diaper is properly closed (no tape hanging around) because that can cause jambs.,[]
"I chose this product because unlike the Diaper Genie you don't have to buy replacement bags, just pop in a tall kitchen garbage bag which we all have in our homes anyway.",[]
I have twin boys and this product works great.,[]
I recommend spraying it with Lysol and letting it air dry in between bag changes.,[]
This works for me.,[]
It also holds a lot of diapers.,[]
I highly recommend it!,[]
I'm SO glad that we asked the sales associate at Babies R Us for help when picking out a diaper pail.,[]
"We were going to get a Diaper Genie like so many folks do, but the associate showed us the Diaper Champ and how easy it was to use.",[]
All I have to do is turn the handle and the diaper goes down.,[]
There's no twisting and no special liners to buy.,[]
"As far as smell goes, ALL diaper pails will smell if they're not changed often enough.",[]
We don't have a problem with ours smelling as long as we change it every three to four days (which should be done no matter what product you buy).,[]
When I got pregnant with my second child (they are only 18months apart) we bought a second Diaper Champ.,[]
We also just purchased one for my brother-in-law and his wife for their new baby.,[]
"Before buying ANY other diaper pail, compare it to this one first.",[]
You'll be amazed at how easy it is to use.,[]
So easy to use.,[]
So good at containing odor.,[]
So nice not to have to buy special trash bags.,[]
It's a great product!!,[]
!,[]
Stay away from the other brands that require special refill bags.,[]
What a waste of money!,[]
"Even the ""new and improved"" Diaper Genie can't compare to the Diaper Champ.The Diaper Champ uses regular size trash bags where the Diaper Genie requires special refills.",[]
"I can't imagine why anyone would want to constantly buy expensive refills for a diaper pail, when a simple trash bag is all you need.As for the ""smell"" issue.",[]
Let's face it - diapers stink.,[]
"And regardless of brand, ANY DIAPER PAIL WILL NEED TO BE EMPTIED ON A REGULAR BASIS.",[]
I really think some people don't realize this.,[]
"When I first had my son, I bought a diaper champ to keep at my mom's house.",[]
"When my mom used to change him, she'd dispose of the diaper in the diaper champ, but didn't change the pail.",[]
After about a week she complained because it started to stink.,[]
"I had to explain to her that it wasn't a ""magic pail"", it was still just a covered trash bin.",[]
"(honestly, how did she raise 2 kids?...)",[]
"Now, mom's back on track and loving her Diaper Champ.As far as the odor issue goes, I have seen no difference in odor control between the Diaper Genie vs the Diaper Champ - both work pretty well to contain and control odor better than a regular trash barrel, but neither are odor proof.",[]
This product is amazing.,[]
It is easy to change.,[]
It uses regular bags.,[]
It's odor free.,[]
"And best of all, you can put the diaper in it and flip the handle with one hand.",[]
I absolutely love it.,[]
I had the Diaper Genie before this and was so unhappy with it.,[]
It broke within 2 weeks of when I started using it.,[]
"I bought the Diaper Champ for a friend off of her registry, and after seeing how it worked, I bought one for myself.",[]
I love this product.,[]
It is a must for anyone with a child in diapers.,[]
We've been using ours for going on 5 years and it works wonderful.,[]
You do need to change it a little more frequently as the solid foods start (2 or 3 times a week) but that eliminates any odors.,[]
We use tall kitchen bags that have the odor patch on them.,[]
All our friends who have the diaper genie regret their choice after they try ours.,[]
"Easy to use, no special bags.",[]
I used the Diaper Genie with our first child and I hated it.,[]
We decided to try something new with our second child.,[]
We read the reviews for the Diaper Champ and thought we would give it a try.We saw that some of the problems were that poopy diapers could be messy and that sometimes the smell leaks through.,[]
Here's our solution:USE THE INDIVIDUAL DIAPER DISPOSAL BAGS YOU CAN GET AT TOYS-R-US OR A .99 CENT TYPE STORE WITH THIS PRODUCT!You can get about 50 - 100 bags for about a buck.,[]
"They're great for disposing of diapers when you're out, they're great to clean up messes in the car, and THEY'RE GREAT WITH THE DIAPER CHAMP!",[]
"If you use them with your poopy diapers before you put them in the Diaper Champ, there's no chance of making a mess on the pail and it helps keep the odor contained.I'm giving the product 4 starts instead of 5 because some people might not like having to buy the extra bags.",[]
"The little individual bags are super cheap and great for other things but if you don't have them, the poopy diapers can be a bit messy for this product.",[]
"As much as people have suggested that you make sure the poopy diaper is secure, there are just some poopy diapers that can never be fully contained without some extra help.",[]
"Love it, love it, love it!",[]
This lives up to the hype.,[]
You cannot smell diapers-unless of course you don't change it or clean out.,[]
"You can also use any trash bags you already have around the house, which is why we purchased this particular diaper pail.",[]
"It can be hard to open if you have long nails, but I have found that if you just use the side of your finger instead of your fingertips then it's no problem.",[]
I have recommended this to all new parents!,[]
I registered for this item thinking that I would really need it in my nursery.,[]
After a year and a half we finally gave it away because we never really used it.,[]
"Here are the reasons why:1) We live in an apartment and my son's bedroom is small, so space is valuable and this item took up too much.2) We didn't really see the need for it because after the first month, we didn't really have that many dirty diapers and so it took a long time for it to be filled up.",[]
"Because of this we didn't empty as often as it probably needs to and after about three days, we could start to smell the odor a little.",[]
I hated having to empty it when there were only two or three diapers because I felt it was a waste of garbage bags.,[]
"It was just more convenient to set small garbage can out on the back porch which we could easily empty it when we took out the trash everyday.3) Once my son was able to walk, he would put his toys in the top and flip the lever and it was a pain for me to get them out.I don't know, lots of other people like this pail and have found it useful.",[]
We just didn't use it enough because of our situation.,[]
Maybe my reasons for not buying it aren't good enough.,[]
You can be the judge.,[]
"If you really want a diaper pail, than this may be a good fit for you, but I just think that it isn't a necessity if you are on a tight budget and you are low on space.",[]
I have been very happy with this pail.,[]
The greatest thing... regular trash bags!!,[]
The Next greatest thing... 1 handed operation & it takes only a SECOND!,[]
Awesome!I have not had any issues with odor.,[]
I change the bag every 5-6 days or so.,[]
"If the plunger is not going down, it's because you need to change the bag!",[]
!The only reason I rated it 4 stars is because changing the bag takes a few minutes.,[]
"It can be difficult to open, ALthough, when my daughter gets older and starts getting into things, this will probably be a blessing!",[]
:),[]
This diaper pail worked great - until my daughter started eating solid foods.,[]
When she was strictly breastfed her poop had no foul odor.,[]
Once her poop started to smell the smell started leaking out.,[]
She is 17 months old now and we are off to buy a Diaper Genie.,[]
"Sure, it may be more complicated and a bit more expensive, but right now we are having to change the trash bag in the Diaper Champ every time she poops.",[]
It's such a smelly hassle!,[]
The entire room stinks!,[]
We're spending more on trash bags then we would on Diaper Genie bags.,[]
My advice - buy the Diaper Genie.,[]
In the long run you'll thank me.,[]
