"Older son also pulls this over way more than he ever did with the Genie, and unfortunately, once he figured how the handle flips over, he puts things down inside the hole and flips the handle, so a few of his smaller toys have ended up down in the bag with the diapers.","[('bag', 0.10549480957565062)]"
"He could never do this with the Genie because of its' closeable lid.Overall, I don't recommend this product over the Diaper Genie.",[]
This is an overall horrible product.,[]
"We've only owned this for 2 months, and when my husband and I are moving in the next few weeks, we will be using that opportunity to put these out with the trash and get new Genies!",[]
The Diaper Champ is a life saver.,[]
We have had no problems with odor at all as some other reviewers have complained of.,[]
We empty it out about 2 times per week and only when we open the lid to take the trash bag out do we smell anything.,[]
"Once it's sealed shut, no stench whatsoever.",[]
"No complaints about the Diaper Champ, especially since it is so easy on the pocket-book compared to the rest of the diaper pails out there.",[]
I was a Diaper Champ devotee until my child turned 15 months.,[]
I loved the fact that I didn't have to buy the expensive refill packs and no problems with smell.,[]
I was patting myself on the back for a good informed purchase.,[]
Then suddenly my sweet baby turned into a toddler.,[]
"Although he's been on solids since 6 months, inexplicably his poops started stinking to high heaven!!",[]
"Trust me people, there is a big difference from infant poop smell and toddler poop smell!",[]
"The Diaper Champ, which was fine for the breastfed infant, just didn't do the trick for my 15 month old.",[]
I would put a stinky diaper and immediately the smell permeated the whole house!,[]
I had to change bags after every stinky dipe!,[]
I have since borrowed a Diaper Genie and have seen a HUGE improvement in odor control.,[]
"Believe me, you'll pay any price for a refill if your house reeks.",[]
I am hanging on to my Diaper Champ only because I hope to have another baby next year and I expect to have 2 in diapers for a while.,[]
I will use it with infant diapers only.,[]
Be warned!,[]
The Diaper Champ will suffice for infants but not toddlers!,[]
"If I had to do again, I would have opted for the Genie.",[]
I was very sceptical with purchasing this at first.,[]
"Somehow I couldn't believe this would block odors and the childs room would always smell, but we've had this for a few weeks now and there's NO SMELL at all!!!",[]
We're very happy.,[]
"We used this diaper pail from the day we brought our son home, until about 13 months.",[]
"That's when it went from Oderless, to ODEROUS!",[]
Even when empty!,[]
"So, I took it to the tub, scrub it down with disinfectant.",[]
It still smelled.,[]
So then I used straight bleach.,[]
That seemed to work -- for about 3 days.,[]
Then it started to smell whether there were diapers in it or not.,[]
"However, for the previous 13 months-this is what I encountered -PROS - Using your own bags is much cheaper and convenient.",[]
"The height is a more convenient reach than others, where you have to hunch over.",[]
"Its stable, so a curious toddler can't easily tip it over.CONS - Difficult to open to change bag-twice my bags caught on a sharp edge inside and snagged as I was pulling out-leaving dirty diapers all over the floor.",[]
"Also, diapers tend to stay in the middle, causing the pail to get backed up.",[]
Diapers can get stuck when turned around if you don't tightly wrap them first.,[]
"My toddler thought rotating the  top was fun-he always wanted to play with it (Being a diaper pail, I'd prefer he not be enticed by something so unsanitary.)",[]
I have a four month old baby boy and my husband and I just love the Diaper Champ!,[]
We went through 2 diaper genies in less than a week before we said forget it and bought this 4 months ago.,[]
It is so easy to use and doesn't let the odors out (until you go to change the bag of course - but big deal that takes only a few seconds to do anyway).,[]
I recommend it to all my expecting friends.,[]
I'm glad my husband brought this home instead of a third try at the ever popular but difficult to use diaper genie!,[]
"I bought two of these (one upstairs, one downstairs).",[]
It keeps the smell at bay pretty well and is very easy to use.,[]
I highly recommend this.,[]
"Plus, you don't have to buy the bags for it - just use your own trashbags!",[]
Wow!,[]
This is fabulous.,[]
"It was a toss-up between the Diaper Genie and this one, and we decided on the Diaper Champ since you didn't need refill bags to go with it.",[]
"I go through a TON of diapers a day (I have twins) and instead of making a hundred trips to the trash can in the garage to get the poopie stink out of the house, I use this...and it works!",[]
Absolutely no smell escapes from the Diaper Champ and I can use plain kitchen garbage bags in it.,[]
We're very pleased with ours.,[]
"Spend the extra five dollars on this diaper disposer rather than settle for the ""Genie"".",[]
I have a friend that had the Diaper Genie and complained of it smelling on occasion.,[]
"My husband and I were a little leary of purchasing a diaper pail, but decided to give the Diaper Champ a try!",[]
I am so glad that we did!,[]
We have been using it for almost a month and it is great!,[]
"It is so easy to use, never smells (so far) and I love that you can use your own garbage bags and do not have to purchase special bags to use with this diaper pail!",[]
I would definetely recommend!,[]
"We purchased this diaper pail after trying the ""odorless"" pail for $14 and the ""Diaper Genie"" (second hand)for $5.",[]
"I was VERY disappointed with the performance and smell of the odorless pail, and VERY suprised at the cost$$ of the refills for the diaper genie besides it's difficulty to use (no directions).",[]
"I had wanted & registed for the ""Diaper Genie"" but only got it AFTER using the others.",[]
It was well worth the investment!!!,[]
I love the fact that I can use regular trash bags (I reccomend the scented ones) so it is cheep enough to change frequently (2-3 times weekly) which helps minimize the odor.,[]
"I understand that diet directly affects the odor of the diapers but since we use the babies room as a spare bedroom, it was VERY important to me that the smell stay contained.",[]
"If you ""package"" the diapers with the fasteners before putting them into the pail you will be able to fit more, plus it also helps with odor control.",[]
I also reccomend buying the cheap hanging car air fresheners to hand inside (over the handle) for extra conrol (cheeper than stick ups or the scent disks).,[]
"Don't forget to change the bag frequently, don't fill too full or it will be difficult to turn, occationally spary with disinfectant & let it air out to keep the plastic from absorbing any odors itself (I do it while we are gone for the day).",[]
"We are now expecting our second child and will continue to use this pail, we LOVE it!",[]
!,[]
This was the best diaper pail that I have had yet.,[]
"I tried the diaper genie and a couple others, but this one held the odor at bay, my youngest child is now two and it was the best thing we ever found.",[]
We liked this diaper pail because it uses regular trash bags.,[]
"It definatly keeps the smell contained, but, it will only hold about 15 to 20 dirty diapers before it gets clogged up.",[]
"When it is full, the lid won't turn over without some force.",[]
This is a minor annoyance and it just needs to be emptied more often.,[]
I had the Diaper Genie with my first child who is now 20 months.,[]
"We have a second on the way, due in July and wanted something different since the DG was smelling, even though I deodorized it weekly.",[]
I was shopping at Babies R Us with my daughter and took her to the restroom to change her.,[]
"Inside they had the Diaper Champ and I liked it right away, so I added it to my registry while there.",[]
Someone bought the DC for us very quickly and it was horrible!,[]
"Even thought we wad the dirty diapers up very tight, they always got stuck inside the inner ring of the DC, ripping the dirty diapers to shreds inside, so the smell is awful!",[]
"Granted my daughters' diapers are bigger than our newborns would be, but if we had that problem now, what makes me think that it wouldn't jam as our son got into larger sized diapers?!?",[]
We took it back and got the diaper genie again.,[]
Very glad we did.,[]
Baby Trend Diaper Champ.,[]
The product received appeared to be used.,[]
Came in an old and beat up box.,[]
The inside drum was too big for the pail and they obviously did not go together as a unit.,[]
"After receiving the item, my daughter went back and read the reviews for this seller and it appears that this is a trend.",[]
Sounds almost as if they seller  continues to send the same product in hopes someone will keep it.,[]
I have never had any trouble with anything that I bought on line at Amazon.,[]
com.,[]
I did email the seller and they told me to take it to UPS and send it back.,[]
"They didn't offer to replace it, just said they would do a refund when they received the product back.",[]
"Quick response from seller, we'll see how quick the refund.",[]
Read Reviews on sellers BEFORE you buy.,[]
I loved the Diaper Champ up until my son turned about 8 months old and was on solids for a couple of months.,[]
"I never had a problem with odors until then and love the fact that you don't have to buy special bags, etc.",[]
"At about 8 months, my baby's room just started to stink if we had a dirty (poopy) diaper in there.",[]
"We still use the Diaper Champ, but if we have poopy diapers, we just dump the poop in the toliet, then dispose of the diaper.",[]
"If we happen to come across an especially stinky diaper and put it in the Diaper Champ, we need to empty it (regardless of if its full or not) and put a fresh bag in.",[]
It still is a nice diaper pail and is definately worth the money.,[]
"I guess once you start feeding your baby food other than breast milk, it's inevitable that the diapers will be pretty stinky!",[]
"It's true, it does not work as well as the diaper genie.",[]
I am going back to that.,[]
"I have used both and I can assure you, this product does not contain smells - I even put it in the closet, and still we smell it!",[]
Save yourself the money.,[]
I received this 2 1/2 weeks ago as a gift from my registry a couple days after I came home from the hospital.,[]
What a great little contraption!,[]
For me it holds a week's worth of dirty diapers (small size)..just in time to get out to the trash!,[]
I used the diaper genie with my other children--what a pain in the neck that was.,[]
I have had no problems with it whatsoever--it is very easy to use.,[]
I would highly recommend this product.,[]
I chose this pail because I didn't want to spend alot on a daiper pail.,[]
"In the end, I spent more because I had to buy a different one.",[]
"After only a few months of using it, the seal broke and  the odor came through.",[]
The latch would get stuck making it difficult to change the bag.,[]
This is certainly not worth buying!,[]
!,[]
I have the Diaper Champ from day one and my baby is now 9 months old.,[]
I don't have any problem with odor.,[]
"Of course, you have to clean it once in a while (maybe once every week or 2), well, it's a garbage disposal!",[]
What do you expect?,[]
"Honestly, I rarely even clean it.",[]
"It's easy to use (no turning and changing of liners), easy to clean, much cheaper than the Diaper Genie as you can use regular plastic garbage bags, and it is a good size.",[]
"I gave it 4 stars instead of 5 because I believe nothing is perfect and because of the size, it takes up more space than the Diaper Genie.",[]
"Despite that, I highly recommend the Diaper Champ!",[]
The Diaper Champ came easy to assemble- only took 2 minutes to put together!,[]
"The design is simple, yet brilliant, and the odors are sealed inside the Diaper Champ until the bag needs to be changed.",[]
Our baby's room never smells!,[]
We didn't even think about buying the Diaper Genie because we thought the idea of buying special bags and odor discs was ridiculous.,[]
"We normally use standard tall kitchen trash bags, but if you're into reusing plastic shopping bags you can even use them in the Diaper Champ (although you'd need to change the bag everyday...BUY IT!",[]
"The best thing about the Diaper Champ is that you can use regular trash bags, you don't have to purchase special ones.",[]
It also holds a good amount of dirty diapers.,[]
I usually go close to a week before changing the bag.,[]
My son is 14 mos old and we've used this since he was born.,[]
"I do notice some odor problems on occasion, but that comes with the territory.",[]
"Like the last reviewer said, the older the baby gets, the more smelly their diapers become.",[]
"I simply change the bag, get rid of the bad smell, and it's fine.",[]
I love that it's one handed and not hard to use at all.,[]
"It is pretty difficult to open, the latch that you have to grab onto is very tight and hasn't loosened one bit in 14 mos.",[]
I suppose that could also be viewed as a positive since I know my curious toddler won't be able to get into it!,[]
"All in all, this is a very good product and I would definitely recommend it!",[]
We bought the Diaper Champ when my son was born.,[]
I absolutely loved it - at first.,[]
I loved the ease of using it and the fact that we could use regular trash bags.,[]
Very convenient.,[]
I even gave several of these as shower gifts.,[]
"However after only 9-10 months, the thing started making my son's room STINK.",[]
I guess the seal was not working properly anymore (just my opinion).,[]
"I contacted the Baby Trend company to get a replacement - after all, it had only been 9 -10 months.",[]
The company did not back their product!!,[]
"They just said ""We don't do replacements"".",[]
They just said to clean the thing really well.,[]
I ALWAYS cleaned it when I replaced the bags.,[]
But I tried everything they said to do.,[]
Still - STINKY!,[]
"I contacted them again and complained, but again got really no help.",[]
"I was telling a friend of mine (to whom I gave one of these as a gift) about my problem, and she said that hers is doing the same thing.My opinion now - don't buy it.",[]
"It will probably be great at first, but then you will have a stinky room.",[]
It says something to me when the company won't even back their products.,[]
He seemed to like it just fine.,[]
I think it did a pretty good job of containing the diaper odors.,[]
"After using the Diaper Champ while babysitting for a friend, I decided this was the one for me when my baby was due.",[]
She is now five weeks old and I just love the Champ.,[]
"It is the right height, I don't have to bend over to put a diaper in, I can use one hand, and it contains odors (although there really aren't many odors yet as she is breastfed.)",[]
"I love that it uses regular plastic bags, even grocery bags.",[]
"The handle doesn't turn too well when the bag is full, which is fine with me as it indicates it's time for a new bag.",[]
I will recommend the Diaper Champ to all my friends.,[]
"This may look fancy, but does not control soiled diapers odors, only wet diapers odors.",[]
You are better off buying a trash can with a lid.,[]
This odor absorbing champ even absorbs the odors from those diaper genies down the street...  My one step diaper champ sure beats the 5 steps it takes to twist a diaper in the that genie.,[]
Who want to do extra when you are doing enough as it is?,[]
"- The CHAMP is icing on the cake - every mommy gets psyched when their boy (or girl) poops because it means everything is working... and when you toss that diaper into the the mini R2D2 unit, you know you did it right... simplicity... ahh...",[]
What a brilliant idea this diaper champ is!,[]
Those who wrote about the bad smell must be doing something wrong.,[]
"I have had it for about two weeks now, after my genie broke, and this thing works great!",[]
"And changing the bag is so easy, I can barely believe it.",[]
"I think this is the greatest diaper pail which uses REGULAR trash bags, not the pricey refills.",[]
I am very glad I went with the positive reviews and bought this pail.,[]
A great buy.,[]
This was great for first 5 months of my baby girl.,[]
But now that she is eating solids the odor is escaping out and we are constantly using airfreshner.,[]
First 4 months it was in our bedroom and we did not even smell any odor.,[]
"Bottom line if you buy this for your newborn, it is fine.",[]
But be prepared to buy something else (diaper genie ?),[]
which can trap the odor better.I am now looking at the diaper genie.,[]
This product is awesome.,[]
"Easy to use, no smell!",[]
The best thing about it is the savings since you are able to use regular trash bags.,[]
This is a great diaper pail!,[]
"Smells aren't a problem, maybe because we empty it often.",[]
I like that is uses my regular garbage bags which I buy in bulk already anyway.,[]
This works ok.,[]
It does tend to get stuck a lot and can smell from time to time (granted...it's holding dirty diapers).,[]
I bought it because I like the fact that you could use a regular garbage bag.,[]
Plus it's a little taller than other models which helps when you're a tall mommy!,[]
"You wont regret buying this product over the Genie, it is odorless and very useful.",[]
Best of all you can use your everyday cheap bags with no extra costs that you wont afford to buy after a while!,[]
"We registered for the Diaper Champ because we liked the fact that it uses regular trash bags, not special refills.",[]
Our feelings for this product deepened even more this weekend after a run-in with the Diaper Genie at my brother's place--the thing was *so* much harder to use!,[]
"With the Diaper Champ, you just place the diaper in the top and flip the lid.",[]
The diapers (and their odors) are well sealed in the main container.,[]
"With the Diaper Genie, we had to open the thing, push the diaper down, twist the ring, then close it and twist the lid again--puh-leeze!",[]
"Lots of our friends swore by the Diaper Genie, but after this incident with it, I decided to post a review for the Diaper Champ and encourage other Moms to go for the better product.",[]
"We looked into the Diaper Geenie, but why would you spend so much money on the refills over time when all you have to do is...take out the trash!",[]
!It kills me to read reviews where people are wanting the kinds of pails so they don't have to take out the trash as often...how long is too long?,[]
We take out the garbage 2 times a week or as needed and even when we have gone for a whole week we don't have any problems with the smell of diapers from this pail!,[]
"Of course common sense applies here.We are members of Costco Wholesale and purchase their &quot;tall kitchen trash bags&quot; and they fit perfectly in this, we have even purchased the Ruffies garbage bags that smell like lavender as our baby got older and her poop got a little smellier...but the bottom line to this is keep the pail clean...even a wipedown with a baby wipe would work, and take out the trash at least once or twice a week!","[('quot', 0.10104755308958321)]"
This is the best pail and we have given them as gifts...worth the money in the end!,[]
"Very easy to use, no smells at all.",[]
No special bags to buy.,[]
An easy decision.,[]
when changing the bags it's easy to pinch your fingers when opening the cover.,[]
it's also stinky.,[]
"there's no barrier from the rotating portion and the diapers so when the diapers get close to the top it can get pretty stinky...yes, change it often and wash it often.",[]
once baby is eating solid food it's tough keeping it from smelling.,[]
"i wipe daily and wash out once a week, and also change the bag at least 2x's a week.",[]
there's got to be something better!,[]
While my daughter (now 10 months) was breastfed this diaper champ was a champ but now that she's on solids and teething.... oh nelly!,[]
"Now I'm in the position of searching for a better, as in ""not so stinky"", diaper pail.",[]
"Even with regular trash (odor absorbing) bag changes and liberal use if Lysol, nothing has helped the stench.",[]
"We had hoped to keep it throughout the diaper changing process, but now we are forced to look for something else.",[]
The best way better than the diaper genie!,[]
No smell!,[]
It lasted till my kid was done with diapers!,[]
I think this should be a staple in every household with a child!,[]
It is so much easier to use than the diaper genie and the other brands.,[]
The fact that you can use regular trash bags is a BIG plus because you don't have to stock up on refill's or run to the store when you realize you don't have anymore.,[]
There is no oder (until you open it up to empty) and it is easy to use..great item!,[]
"After reading several reviews on diaper pails, I decided to try the Diaper Champ.",[]
The name fits!,[]
It makes chaging a diaper so much easier.,[]
"NOTE: To help cut down on the smell, take the diaper and wrap it up using the tabs!",[]
I would highly recommend this to any new moms,[]
Excellent product.,[]
Holds nearly a week of soiled diapers without release of any unpleasant odor.,[]
Easy to operate to release and discard soiled diapers.,[]
Would recommend that others purchase.,[]
I have an 11-month-old baby and purchased the Diaper Champ because of the ability to use regular trash bags and the promise to be odor-free.,[]
"For the first few months, it worked great!",[]
"I had to return the first one, because the seal ripped, but the second one has been fine as far as that goes.It seems that the longer I use it, the worse the smell is.",[]
I have to change the bag at least every other day!,[]
"I have tried stick-ups, sprinkling baby powder in it, spraying it with Lysol, cleaning it out with 409, and nothing seems to help.",[]
"When I change the bag, I have to let the ""Champ"" air out overnight, and then it is gross by the next afternoon.A friend even puts her diapers in the blue disposable bags before inserting them into the Champ, and she has the same problem I do.The refills for the Diaper Genie are a hassle, but that worked a lot better for me with my TWINS six years ago.","[('champ', 0.13912283223233196)]"
"So, it handled double the amount of diapers and still held up for three years without the problems I am having now.",[]
"At first we were thrilled with the Diaper Champ--when our daughter was a newborn it was a lifesaver, and there was never any odor in or around the container.",[]
"We would wipe it down with Clorox Wipes and spray it with Lysol to help disinfect, and that seemed to do the trick.",[]
"Then our daughter started eating solids, and, as parents know, this changed the smell of her dirty diapers.",[]
And suddenly the Diaper Champ was no longer up to the job.,[]
It didn't just smell dirty--it was RANK.,[]
"This was despite frequent cleanings, changing the bags a few times a week, no longer storing soiled diapers in the thing--we'd throw those out right away and just store wet diapers.",[]
"We tried sprays and smell absorbers and old fashioned elbow grease to help it smell better, but NOTHING worked.",[]
It's like the odor seeped into the plastic and wouldn't leave.,[]
"We've switched to a regular old garbage pail, the kind you buy in a kitchen supply store, and that has proven FAR better, and cheaper, than the Diaper Champ.",[]
"We love the Diaper Champ, just wish it could hold more diapers!",[]
"Really, I can't smell anything once the diaper is in there and it's very easy to load and unload.",[]
"Plus, the price can't be beat.",[]
So we have a 2 month old baby girl and use the Diaper Champ.,[]
No real complaints at all.,[]
The smell is negligible.,[]
"And you'll find yourself dropping other trash beyond diapers into this convenient trash can.Now, once your kid is older and eating solid foods, things might start getting stinky.",[]
But I've heard from friends that smell problems are ubiquitous for older kids regardless of the diaper pail.,[]
They put poopy diapers in a plastic grocery store bag and immediately take them out of the house.,[]
Wet diapers are still fine.,[]
"These guys have all sorts of diaper pails, so I don't think that any pail is really much better on that front for older kids.A great aspect of the Diaper Champ is the use of regular trash bags.",[]
Sure it saves money.,[]
But the key is that you don't have to plan ahead to prepare for the onslaught of diapers that your kid will produce.,[]
Suppose that it's 3:00 AM and you've run out (or are running out) of Diaper Genie refills.,[]
You're not going to be happy.,[]
Maybe you run to the 24 hour drug store and pay out the whazoo for a refill.,[]
"But with the Champ, you don't have to worry about that.",[]
"And you'll have lots of things to worry about with a newborn (and LOTS of diapers to change), so a sufficient supply of diaper pail refills is one of the last things that you'll want to think about.",[]
"To avoid inconveniences associated with the prospect of running out of refills, I'd never trade my Diaper Champ for a pail that requires proprietary refills.",[]
I love this product.,[]
"I used cloth for the first 10 months of my daughter's life, then went to disposable.",[]
I found that the garbage pail just wasn't gonna cut it when it came to disposing of her diapers.,[]
"I chose this one because I don't have to buy the silly refill cartridges, and I'm glad I made that decision.",[]
Put a dang stick up deoderizer in this thing and call it good people!,[]
"Seriously, diapers smell, so stop whinning!",[]
"This fills up quite quickly, I have to change it twice weekly (stay at home mom), so it doesn't smell to me.",[]
"I guess if you were leaving it for a week or more, you might have an issue.",[]
"But I think this product works wonderfully, and doesn't smell.",[]
